"","text"
"1","future multiple time world champion lando norris "
"2","  happened  lando norris"
"3","lando norris   worst driver ive  raced  lando norris"
"4","   lando norris  carlos sainz visit  website  formula mclarenf "
"5","    lando  stock visit  website  formula landonorris mclarenf "
"6","england    lando norris   entire offense  lance stroll   defense  guenther steiner   boss"
"7","youre  legend  lando norris bids goodbye  teammate daniel ricciardo   heartfelt message   aussie lea "
"8","lando norris    driver outside  top  teams        podium  season  "
"9"," lots   lando visit  website  landonorris "
"10"," lineup red bull max verstappen sergio perez ferrari charles leclerc carlos sainz  "
"11","notzo lando norris   lando norizz"
"12","landonorris danielricciardo  didnt    lando norris"
"13","zazeihd red bull  tried   signed  contract extension earlier   "
"14","norarealf lando norris  friday"
"15","iiiuminateandy  lando norris liked "
"16","teamlndo landonorris  lando norris liked "
"17","norris  piastri  mclaren  season lando  look      guy    experience "
"18","lando norris  leaving bar"
"19","lando norris    enemy    cause     "
"20"," lando norris extracted  maximum    mclaren beating  teammate    embarrasing  impr "
"21"," am leaving  fucking app      lando norris fault "
"22","faking  lando norris ln wattpad "
"23","aovibees lando norris  th "
"24","lando norris   mclaren lit   setting sun formula  grandprix landonorris landonorris "
"25","mclarenf  lando norris liked "
"26","mclarenf landonorris  lando norris liked "
"27","mclarenf landonorris  lando norris liked "
"28","mclarenf landonorris  lando norris liked "
"29","    lando norris  abu dhabi  past   "
"30","quadrant secures creatorfocused partnership  jbl quantum  "
"31","lando norris   sick"
"32","max verstappen  lando norris  rb   amazing  day"
"33"," podium   wild lando norris appears  "
"34","lando norris    fine  "
"35"," guy thank god     norris   lando  "
"36","quadrant  secured  partnership  jblaudios jbl quantum brand   official headset partner jbl quan "
"37","lando norris   comfortably    rest  midfield podium top finishes  "
"38","lando norris danny ric   pleasure  friend thanks   thanks    times thanks  "
"39","lando norris makes   nicest  admission  mclaren grandprix gptoday formula  fnews "
"40","reddit     single midfield driver     podium lando norris  imola  landonorris "
"41"," lando norris    podium"
"42","wearetherace   true landos dad  chuck norris "
"43"," various times     star wars movies chuck norris  considered     han solo luke  "
"44","lando norris wearing palm angels     considered  deeply"
"45","lando norris  extraordinary   onelap pace somehow someway hes    conversation   car tha "
"46","  lando norris   redbull ferrari  mercedes  hes challenging verstappen   world championship "
"47","lando norris  rumored  join acura   detroit grand prix"
"48","superpanch rbeltman brrrake   lando norris   red bull seat   wouldve   proper "
"49","   season ratings  red bull max verstappen sergio perez ferrari charles leclerc  "
"50","lacestrol  fight   championship  goes   portimao  shanghais replacement lando norris actually wins  race"
"51","lando norris  belgian"
"52","question lando norris   wish youd      fight oh          wi "
"53","    lando norris stan   welcome  follow  account"
"54"," topps chrome  lando norris freshest gold refractor rc  sgc  ebay"
"55","nicholas latifi  lando norris  collide      finish  race"
"56","yes  hate lando norris yes    crush   yes    mid  abt  "
"57","louisxsun honestly   books id     wins       competition easier  "
"58","hrtmates yeah    legs ill    lando norris"
"59","    season   comfortably admit  lando norris  definitely  top driver   grid   debatably top "
"60","    finished ahead  sixthplaced lando norris  finished    ahead   frenchman "
"61","carlos sainz  lando norris      "
"62","   controversial   lando norris    third  driver   grid  season"
"63","    alternative  lance stroll   lost   time  yuki tsunoda vettel    "
"64","  sebastian vettel  retired  favourite  drivers  probably   mixture     season "
"65","lando norris     little bit   lando  faultless   fast   season  mclare "
"66","lando norris impressed   finishing    managed  pick   fastest lap  sebastian vettel  "
"67"," bad pour lando norris ici"
"68"," followed lando norris  instagram  am  coming "
"69","okay goodnight lando norris      rest "
"70","lando norris   tv screen "
"71","formulastats lando norris th  fastest lap     goat"
"72","lando norris    fastest lap  perfect     season    tough race  wasnt    ge "
"73","im afraid ive rested     lando norris  hot "
"74","lando norris  join  nascar  nbc tv booth  season"
"75","  watch lando norris  bbctopgear bbc "
"76"," difference  lando norris  wasted  mclarenseb  ricciardo   huge loss   pity  stroll  "
"77","outside   obvious choices lando norris  haas    serious "
"78","  feel gay    time   lando norris bro "
"79","lando norris solidified    toptier driver  season     fun seeing      mcl "
"80"," fucking told  lando norris  gonna dm   "
"81","podium george russell lando norris "
"82","   season  official    send   thank  messages   favorite boys lando norris  yuki tsunoda"
"83","lando norris     rest   championship  driver outside  top teams    podiu "
"84","  tactical decision  lance stroll    alternative   stops    losing  mu "
"85","lando norris     fastest lap  perfect     season  tried  build   gap    "
"86","autosport    tell   story lando norris th   lance stroll th       "
"87","lando norris sixth  abu dhabi grand prix "
"88","cocedr autosportold wtfofficial  sebastian vettels german flag design wasnt recognizable lando norris  "
"89","lando norris     rest basically "
"90","ksi lando norris  bigger  "
"91","  predictions thread rookie   logan sargeant driver    lando norris  improved team "
"92","lando norris talking  vettel   hes learned     seb looks    "
"93","lando norris beating  nearest rival        car   bahrain     "
"94","lando norris driver     max verstappen  doubt  "
"95","  girl  doesnt play  lando norris"
"96","   unhappy       accomplished         lando norris "
"97","lando norris reminds   shrek"
"98","landonorris weve      perfect weekend    season  picked      fastest lap "
"99","hi    daniel ricciardo  lando norris wallpaper  feel free   please  credit   repost  "
"100"," funny      introduction  sydney   watching  train podcast  lando norris    "
"101"," wondering  lando norris managed  drag  shitbox   mclaren   podium  imola "
"102"," lando norris    podium"
"103","  hell    feeding lando norris recently"
"104","   ranking grid    feel     time charles leclerc carlos sain "
"105","ieclerc bros    wheel  wheel racer  season  hes getting slandered  lando norris"
"106","   dramatic    im ready  risk    charles leclerc  lando norris  saying"
"107","aidenelliott  cornering wasnt    lando norris indicators   broken verstappen getting "
"108","aldas  max verstappen george russell lewis hamilton lando norris fernando alonso worst  "
"109","ocon  terms  todays race seventh     result     lap     sixth  "
"110","im  child  divorce daniel ricciardo  lando norris "
"111","lando norris   fastest lap  abu dhabi     driver  outside  top teams    "
"112","batteryvoltas michaelangelo  lando norris   perfectly"
"113","ready  dj lando norris tonight  expect   seb   lil booth      joint interview "
"114"," thank seb      lando norris george russell  sebastian vettel    "
"115","lando norris    gay ass name"
"116","lando norris   race "
"117","  biggest  driver   world according   book max verstappen sergio perez george russell ca "
"118","daniel   weekend    feeling comfortable   car      look   gap  "
"119"," formulaoneisajoke im lucky    able  race  seb  past   time world champion  "
"120"," perfect mug    fans   fgp lando landonorris mclaren gulf motorsport "
"121"," georges maiden win  daniel ricciardo  lando norris space hopper fun heres  pundits  moments  "
"122"," pm post     bestoftherest lando norris    podium outside  top  teams rb "
"123","vyzzeee hbfutbol   mean   russel  oh  god lando  merc    especially  ricciardo left "
"124","scuderiaferrari  biggest  driver   world according   book max verstappen sergio perez george "
"125","lando norris   achieved    phenomenal "
"126","lando norris  sebastian vettel abudhabigp  "
"127","max verstappen  lando norris  collide      finish  race"
"128","sebastian vettel  lando norris thats  thats  tweet  "
"129","underrated lando norris overrated kmag "
"130","  biggest  driver   world according   book max verstappen sergio perez george russell ca "
"131","scuderiaferrari charlesleclerc carlossainz  biggest  driver   world according   book max ve "
"132"," thank seb      lando norris   truly touching message  thanks  sebastian vettel  "
"133"," maxverstappen  biggest  driver   world according   book max verstappen lewis hamilton  "
"134","aldas  max verstappen fernando alonso lando norris george russell charles leclerc lewis ham "
"135","lando norris  managed  actually   cry  hope   proud  yourself"
"136"," final top  drivers  max verstappen sergio perez charles leclerc george russell  "
"137","lando norris        day   retire"
"138","lando norris  literally         personality   paddock   "
"139","lando norris carrying mclarenf    constructors "
"140","despite  horrific start   season  mclaren lando norris finishes    rest cracking season lando  abudhabigp"
"141","  driver outside   top teams   podium     fastest lap    exits  wit "
"142","lando norris  sooooo autistic"
"143","lewis hamilton underrated lando norris overrated "
"144","  fastest lap  mean    fastest     lando norris "
"145","meet lando norris    rest podium    driver outside mercedes redbull  ferrari time "
"146","schumihoney  average lando norris fan"
"147","lando norris fastest lap    "
"148","sidenote  tf  lando norris   fastest laps  season   orange tractor  "
"149","highlight   season  lando norris"
"150","fia   biggest  driver   world according   book max verstappen lewis hamilton george russ "
"151","fia  lando norris deserves "
"152","teamlndo landonorris lando norris     outside  top  teams    podium   gtgtgtgtgtgtgtgt"
"153","teamlndo landonorris    rest award goes  lando norris "
"154","lando norris remains   driver   season    podium finish outside   top teams "
"155","im  blaming lando norris  charles  infested   illness"
"156","lando norris getting       championship   margin isnt   surprise    victim "
"157","jaybnufc    closer championship race  season whoever wins    hope lando norris     mix "
"158","    mclaren trying  catch mercedes   season      happen    am "
"159","max verstappen wins   race     charles leclerc  sergio perez carlos sainz  "
"160","lando norris   final fastest lap   season      driver outside  red bull ferrari  "
"161","   cant sense  sarcasm im absolutely  hundred percent   lando norris   wholehea "
"162","  driver reveals  dream destinations  travel essentials  racing   globe "
"163","formuladino lando norris   "
"164","lando norris     rest  midfield driver  score   midfield driver    podium "
"165","lando norris   formula champion "
"166","mclarenf lando norris  driver  score  podium   midfield  driver  score   th "
"167","lando norris  fastest lap thats  win   book fabudhabi "
"168","   lando norris       max  driver   season"
"169","mclarenf  midfielder   lando norris super impressive"
"170","  predictions    drivers championship   charles max nearly tied    charle "
"171","       favorite driver  lewis leaves  sports lando norris step "
"172","thank  yuki tsunoda  lando norris    cry"
"173","mclaren  lando norris postrace radio    fastest lap   race nor sarcasm   fastest lap "
"174","lando norris single handedly keeping  afloat   generational "
"175","lando norris  daniel ricciardo postrace radio danny ric    pleasure  friend thanks  everyth "
"176","lando norris postrace radio   mate   ah stressful  little bit yeah  job     "
"177","   reminder  lando norris    driver outside  top teams  stand   podium  season "
"178","ahem lando  th  norris"
"179","pagelle  max verstappen charles leclerc sergio perez george russel carlos sainz lewis hamilt "
"180","  lando norris  compete   championship soon "
"181","  season    lando norris ill   amazed   youre  learning  getting  ye "
"182","fanaticsferrari  biggest  driver   world according   book max verstappen lewis hamilton geo "
"183","formula etihad airways abu dhabi grand prix corrida max verstappen charles leclerc sergio perez "
"184","top drivers   season max verstappen george russell lewis hamilton lando norris charles lecler "
"185"," official lando norris     driver   touch  steering wheel"
"186","appreciation tweet  lando norris   driver outside   top teams  stand   podium  season  "
"187","lando norris fastest lap   car"
"188","danny ric   pleasure  friend thanks   thanks    times thanks   laugh  "
"189","lando norris     rest  driver    top team  score  podium   easy season   ma "
"190","lando norris  driver   midfield   podium  midfield team driver     midfi "
"191","lando norris postrace interview im happy im    finished  position ahead im  thinking  nex "
"192","lando norris deserves   praise      fastest lap    car   season   boy abudhabigp"
"193","lando norris  season "
"194","round abu dhabi grand prix results max verstappen charles leclerc sergio perez fastest lap lando nor "
"195","mcl   fastest lap lando norris   insane"
"196"," formula race abu dhabi gp winner max verstappen red bull fastest lap lando norris mclaren driver "
"197","lando norris   fastest lap sebastian vettel  driver   day abudhabigp"
"198","lando norris im  fragile   "
"199","  fastest lap  driver   podium outside  top teams  entire    respect    "
"200","lando norris   rest   car th fastest   driver"
"201"," season  lando norris    rest          driver    top team "
"202","lando norris  fastest lap   tractor  true  "
"203","lando  th    fastest lap  landoneta    job   daniel th    race th "
"204","lando norris  driven  wheels    absolutely shit box  season btw"
"205"," season      drivers   podium  ferraris  mercedes  red bulls  lando "
"206","lando norris    rest  season   driver outside rb merc  ferrari    podium"
"207","lando norris officially   driver outside   top  teams    podium thats  driver "
"208","lando norris fastes lap"
"209"," max verstappen charles leclerc sergio perez carlos sainz george russell lando norris esteban  "
"210","abudhabigp results max verstappen charles leclerc sergio perez carlos sainz george russell land "
"211","lando norris final fastest lap  "
"212","lando norris fastest lap abudhabigp "
"213","lando norris   fastest lap   race  abudhabigp  "
"214","lando norris wins fastest lap  tipped    "
"215","   fastest lap  love  lando norris"
"216","lando norris fastest lap fair "
"217"," fastest lap   race goes  lando norris  podium finishers  doing burnouts abudhabigp"
"218","fastest lap lando norris"
"219","lando norris  charles leclerc  love   fucking   am    proud"
"220","lando norris fastest lap   race yesssssssssssss"
"221","lando norris getting  sixth  finish   fastest lap thats  goat "
"222","fastest lap lando norris"
"223","lando norris  fastest lap"
"224","lando norris fastest lap"
"225","lando norris   fastest lap   race  abudhabigp "
"226","lando norris        driven  brick   mad     am  proud  "
"227","lando norris  th  fastest lap "
"228","max verstappen crosses  line  win  abudhabigp  charles leclerc  sergio perez carlos sainz comes ho "
"229","grave lando norris fastest lap"
"230","lando norris fastest lap   abudhabigp "
"231","lando norris  fastest lap"
"232","lando norris currently   fastest lap   race  abudhabigp"
"233"," lando norris   lonely th  guy  racing   own "
"234"," lando norris    podium"
"235","lando norris fast laps"
"236","lando norris   fastest lap currently  laps      else scheduled  pit  "
"237","lando norris  married    finish"
"238","lando norris getting  fastest lap      top teams "
"239","lando norris  legend fastest lap   car"
"240","lando norris fastest lap  interval "
"241","lando norris fastest lap "
"242","lando norris fastest lap lando norris fastest lap"
"243","lando norris getting  fastest lap  th wtf  mattywtf wtfofficial abudhabigp abudabigp "
"244","lando norris   "
"245","love lando norris  hell  reach   potential  mclaren    driver pushing  midtable car  "
"246","lando norris  flying "
"247","lando norris fastest lap "
"248","lando norris   fastest lap    race   season   orange tractor"
"249","lando norris fastest lap yes sirrrr   abudhabigp"
"250","lando norris fastest lap sooo true abudhabigp "
"251","lando norris fastest lap sorry "
"252","  lando norris"
"253","lando norris fastest lap"
"254","lando norris fastest lap"
"255","lando norris  goat "
"256","lando norris   dawg   "
"257","lando norris fastest lap"
"258","lando norris fastest lap "
"259","lando norris fastest lap omggggggggg"
"260","lando norris fastest lap"
"261","lando norris fastest lap   tractor"
"262","lando norris fastest lap lt"
"263","lando norris fastest lap woyyyy"
"264","lando norris fastest lap  fuck "
"265","lando norris fastest lap ok  "
"266","lando norris fastest lap "
"267","okay  lando quick norris"
"268","lando norris volta mais rapida stop  count"
"269","lando norris fastest lap "
"270","lando norris     lando norris race doing      mclaren reasonably ahead   rest "
"271","confirmed lando norris   top priority hahahaha landojpg moment  max amp charles confusion  sending  "
"272","lando norris    name   iconic duo"
"273","lando norris overtakes sebastian vettel abudhabigp "
"274","lap fernando alonso   charge taking     laps lando norris  past vettel  th abudhabigp"
"275"," top  drivers  history max verstappen  charles leclerc  juri vips  michael schumacher "
"276","lando norris races "
"277","bro im gonna miss daniel ricciardo amp lando norris    "
"278"," george russell  wiping  lando norris   pit lane"
"279","lap george russell  held      sent    path  lando norris   potential  "
"280","lap esteban ocon  yuki tsunoda  pierre gasly pit  hard tyres drivers begin    strategies "
"281","lando norris  underrated  insane"
"282","lando norris   wheels   track    drs zone  lap      track limit vio "
"283","norris running  clean air       lando   reporting  deg"
"284","lando norris finding     own  th    grand prix abudhabigp "
"285"," lando norris finishes  hamilton ill  happy "
"286","despite lewis hamiltons formula car losing power lando norris havent   gain     moment adudhabigp "
"287","formula teams crossword tshirt    limited time grab   abudhabigp max "
"288","anyway lando norris   baby"
"289","warra race win    lando norris"
"290","george russell   statpad  overtake  lando norris "
"291","fs lando norris talks   path  racing  seasons highlights  teaming   tumi "
"292","fs lando norris talks   path  racing  seasons highlights  teaming   tumi "
"293","cars motors formula fs lando norris talks   path  racing  seasons highlights  teaming   "
"294","fs lando norris talks   path  racing  seasons highlights  teaming   tumi "
"295","lost    lando norris "
"296","wtfofficial lando norris wins"
"297","lando norris   grand prix winner   "
"298","      hes  gonna   talk  lando norris  "
"299","lando norris  annoying ill  honest"
"300","lmao lando norris     relatable    "
"301"," wheres lando norris"
"302","skysportsf wheres lando norris"
"303"," abu dhabi gp  lando norris  finish th odds bet "
"304","lando norris  bet  look    dancefloor "
"305","lando norris    rest absolute talent congrats   season        landonorris mclarenf teamlndo"
"306","aldas  max verstappen lewis hamilton george russellcharles leclerc fernando alonso lando "
"307","  wins  generation talent lando norris     season "
"308","paddypower askpaddypower     price   abu dhabi grand prix please sergio perez race winner "
"309","yas marina  max verstappen  red bull rb valtteri bottas  mercedes  lewis hamilton  mercedes  "
"310","vanessasierra  lando norris  beat fernando alonso  matchup starting  hours  am roughl "
"311","   lando norris hate  forced icl  makes  joke  itd  loads  people giving  hate"
"312","louistomlinson   watch  world cup  lando norris  youre  rooting  england "
"313","boxxforsofts  lando norris radio  nooooooooo"
"314","leclercluvr mattywtf wow  people        joke dont  whats lando norris    "
"315","wins  poles  debut   lando norris win pole logan sargeant wins poles    "
"316","aldas max   talent  skill     car  unstoppable alonso       "
"317"," bets   bit       race   season  george russell fastest lap   "
"318"," honour    race       lando norris yearly recap month  month"
"319"," happy daniel ricciardo  finally leaving mclaren   wasted money lando norris          team"
"320","   lando norris    sim racer ive raced  "
"321","wtfofficial lando  jury    norris"
"322"," check  lando norris  lewis hamilton"
"323","similar   happened  lando norris   races ago verstappen  obviously  talented driver   hypo "
"324","daniel riccardo  lando norris     famous"
"325","lando norris  love  "
"326"," zhouguanyu alfaromeoorlen rookie    awards lando norris george russell sir ghou zhanyu "
"327","heres     interviews lando norris    race      hes moving  blame "
"328","fviews   true landos dad  chuck norris "
"329","williamhill yourodds lando norris fernando alonso esteban ocon  sebastian vettel   finish   "
"330","williamhill yourodds sergio perez race winner  fav lando norris winner   "
"331","lando norris  exclusively daniel ricciardo  proceeded    picture  red bull     didnt kn "
"332","list  anz certified babas georgenotfound edvin ryding joe locke omar rudberg lando norris  "
"333","  lando   hv extensive knowledge   norris wallahi brudda"
"334","lando norris  daniel ricciardio thread cause im gonna miss   teammates lt "
"335","daniel ricciardo coming    lando norris content thank    "
"336","   lando norris     charles   brazilgp charles  absolutely winning  race sainz "
"337","norrisszn lando norris  washed  overrated   books"
"338","beingxracing lando norris   "
"339","fanaticsferrari  else cant stand little arrogant lando norris "
"340","ieclerc lando norris     guy    punting people   track"
"341","lando norris    season  forget  gone   half  season  adding     "
"342"," im seeing   lando norris     driver   grid  dont   rules "
"343","untouchable  lando norris comes   dressed    "
"344","fanaticsferrari lando norris  rattled charles leclerc fans  lewis hamilton fans   day  charles  "
"345","  crying  lando norris   lol"
"346"," lando norris    podium"
"347","leclercvzn lando norris genuinely  hes gods  gift  earth   hes      "
"348","declan video chatting lando norris   insta      tonight  gonna "
"349","lando norris  nottttt post    daniel  post "
"350","  lando norris      melissa taught       agree   statement "
"351"," people taking  serious guys  couldnt care  abt lando norris  promise   "
"352","wonuknows hahah  dont call  biase    fave driver  thats lando norris       "
"353","lando norris      youve     "
"354","      car   track vettel     esteban ocon   "
"355","lando norris   violate "
"356","aldas  verstappen leclerc alonso russell norrishamilton worst zhou tsunoda schumac "
"357","aldas verstappen russell charles leclerc lewis hamilton lando norris schumacher riccia "
"358","yas marina  lewis hamilton  mercedes  max verstappen  red bull rb charles leclerc  ferrari sf "
"359","lando norris  hes taking kimis       purposefully    grid food poisoning  "
"360","  id        lando norris "
"361","aldas  max verstappen charles leclerc fernando alonso george russell lando norris worst  "
"362","   qualifying saturday  finished  am honored  announce  bestoftherest  qualifying result "
"363","iecirc  wet suit surf  ferrari cap  charles leclerc clothes   lando norris"
"364","lando norris qualifies seventh  abu dhabi         car    mclaren"
"365","gtg   dont       trouble lando  gtg youll  lando   british thenwhy "
"366","   lando norris  instagram post    caption   sarcastic joke   joke    "
"367","aldas  max verstappen charles leclerc george russell lando norris kevin magnussen worst  "
"368","lando norris qualifies seventh  abu dhabi         car  "
"369","sirmaxthegoat stef scuderiasenna  bad  meant suzuka  believe lol lando passed max   max losing  "
"370","aldas  max verstappen lando norris fernando alonso charles leclerc lewis hamilton worst nicho "
"371","jamesoberiko aldas top five  max verstappen charles leclerc lando norris lewis hamilton  "
"372"," lando norris laughs  british hahshshhsd"
"373"," lando norris sleeps  night knowing     mad   breathing "
"374","aldas top five  drivers max verstappen george russell charles leclerc lando norris lewis "
"375","lando norris   quali         car   struggled  bit    conf "
"376","redluca someonetookjack verstappen       bestie lando norris races ago  rules apply"
"377","  lando norris photography account "
"378"," heard    fault  george russells hilarious    lando norris cheeky charles leclerc dig "
"379","lando norris  type  mf     actually mean  hide    joke   cant convince  "
"380","  lewis     dinner   night       fed      brazil "
"381","  sending silvertongue  lando norris edit "
"382","lando norris   jk  time  makes  joke   interview"
"383","lando norris   type  guy   smth mean  hide    joke "
"384","kyschize yeah      lando norris     shut  please"
"385","  lando norris hate acc "
"386"," lando norris   game "
"387","nopromisesniaii nalibanimle ferrari  ferrari max  screwed   pitstop crew checo  flung  spac "
