"","text"
"792","mclarenf rafredarrows landonorris lando muppet norris "
"793","   paint  own helmets  design  own suit  boots    unique    lando norris design"
"794","mclarenf rafredarrows landonorris pilot lando norris    milkboy"
"795","lando norris  start  pole   italian gp"
"796"," am  supposed  cope  lando norris   moment"
"797","lando norris  top gun "
"798","lando norris reporting  duty  rafredarrows "
"799"," lando norris    podium"
"800"," am win lego technic mclaren formula race car signed  lando norris amp daniel ricciardo "
"801","lando norris  people  school havent heard  speak sits      class  playing video game "
"802","thats    biggest    home  traveling     focusing   "
"803"," karriere mit lando norris rennen  yeahd "
"804","wtfofficial perez    wdc lando norris   win"
"805","carlos sainz hits   super dangerous lando norris  brazilian gp practice  sport read  "
"806","carlos sainz hits   super dangerous lando norris  brazilian gp practice  sport read  "
"807","goodnight   especially lando norris    day "
"808"," lando norris ladies  gentlemen "
"809","lando norris pilot  flight attendant   "
"810","drivethrough  broken lando norris"
"811","lando norris bouncing   abu dhabi grand prix   photo mclare "
"812","lando norris   race "
"813","lando norris com cosplay de maverick "
"814","fix  lando norris"
"815","   wallpaper  lando norris          formula gpabudhabi landonorris mclaren "
"816","lando norris liking  tweet  mine  wasnt   list  "
"817","   lando norris  "
"818","okay guys im liked  lando norris      sleep happy "
"819","lando norris    fucking night"
"820","rossmadlj landonorris  lando norris liked  tweet"
"821","mollymcnamara maxfewtrell landonorris quadrant  lando norris liked  tweet"
"822","katyholmes landonorris  lando norris liked  tweet"
"823","miakook landonorris quadrant  lando norris liked  tweet"
"824","carlando landonorris  lando norris liked  tweet"
"825","pov   daniel ricciardo  lando norris fan  "
"826","jackyhorak maxfewtrell fifakill supergt riabish landonorris theofficialfng aarava quadrant  lando norris liked  tweet"
"827","idkbrittt landonorris  lando norris liked  tweet"
"828","louisxsun landonorris  lando norris liked  tweet"
"829","nitswnorris landonorris quadrant  lando norris liked  tweet"
"830","emilyjane landonorris  lando norris liked  tweet"
"831","top gun maverick starring lando norris   theaters "
"832","lando norris      "
"833","klaudia quadrant  lando norris liked  tweet"
"834","norrispiastri quadrant  lando norris liked  tweet"
"835","theres  lando norris vision    guys  reset  regroup"
"836"," feel   brushed    lando norris followed  andrew tate fanpage  little  fast"
"837","quadrant  lando norris liked  tweet"
"838","  lando norris  free    mess   team  "
"839","lando fucking norris "
"840","pimpabxtterfly landonorris  lando norris liked  tweet"
"841","hbwanne landonorris  lando norris liked  tweet"
"842","lando norris   maverick  "
"843","wtfofficial lando norris win"
"844","sometimes  im  desperate  horny    lando norris vision"
"845","  talks     daniel ricciardo    bitches  dude  george russell heidi berger "
"846","lando norris oh  god "
"847","quadrant  lando norris liked  tweet"
"848","jasondcsoccer lando norris  zak brown "
"849","lando norris questions  stewards actually understand racing  assessing incidents  ye "
"850"," figured   happened  lando norris  quit drinking milk  explains   glow  "
"851","kids eat  vegetables  youll    lando norris"
"852","wtfofficial lando norris win"
"853","lando norris   final race weekend       bouncing      weekend  im  "
"854","lando norris    final race weekend       bouncing      weekend  "
"855","lando norris  fired  alpine"
"856","jo bonnier   fired  life  team theyll  replaced  lando norris   original driver  join zakspeed"
"857","formula teams crossword tshirt    limited time grab    abudhabigp "
"858","lando norris  anthony cirelli   showdown  whos   curlyhaired babygirl "
"859","quadrant  lando norris liked  tweet"
"860"," ride onboard   ferrari  carlos   safety car restart chaos  hamilton collided  verstappen  "
"861","ausgrandprix lando norris  wins thread"
"862","arneausir mrpulsef formationiap     ignore   lando   podium  imola    "
"863","mclaren  mclm lando norris monaco gp gulf livery spark decal  ebay "
"864","formationiap spare     watch lando norris win  race"
"865"," georgerussell aramco lando norris    taking  charles    guess  reasoning  uwuwuwu "
"866","exclusive lando norriss quadrant  teamed   bleach design werks    apparel launch "
"867","lando norris   food poisoning era  charles leclerc   villain era    unstable"
"868","  tell    comes   formula car   mclaren supercar   lando norris  naomi schiff  th "
"869","tumi unveils mclaren collection   driver lando norris "
"870"," lando norris    podium"
"871"," mclaren  alphatauri  roles  reversed lando norris  scheduled   tire test  world champions "
"872","lando norris win  seb lewis daniel  max doing  donuts  "
"873"," heres  schedule  media day tomorrow carlos     tv pen  valtteri bottas pierre gasly lan "
"874"," formula history repeating  wild conspiracy theory charles leclerc lando norris george russell max "
"875","ludwig     bros vs pros  lando norris "
"876","starter pack fangirl mclaren  lando norris  abudhabigp "
"877","charlesleclerc  tweet  quoted   article  essentially sports "
"878"," karriere mit lando norris rennen  yeahd "
"879","   join  tv pen valtteri bottas pierre gasly carlos sainz lando norris alex albon zhou guanyu est "
"880","     word  daniel ricciardo  lando norris   merch drops  goodbye money"
"881","lando norris   "
"882","lando norris  mclarens post race debrief  abudhabigp "
"883","junaidsamodien  key   separates alpine  mclaren      drivers  consistently  "
"884"," mclaren   lando norris     ahead  alpine   championship table   papaya ra "
"885","formularacers breaking news  mclaren expect  fight  titles     lando norris pens  deal"
"886"," topps  turbo attax cards mini collector tin bottas leclerc stroll cards lando norris le onh "
"887","lando norris  charles leclerc clash      racing incident "
"888","lando norris   bristol  "
"889"," dont    ass shouldve brought lando norris instead "
"890"," karriere mit lando norris rennen  yeahd "
"891","joereidy jamesward   money im gonna lose  lando norris  "
"892","podium finishers red bull ferrari mercedes lando norris talk  unbalanced "
"893","teamlndo goodgoodgolf  lando norris liked  tweet"
"894","agerabrkn    laps      close  norris yeah   frustrating   honestly  "
"895","    impressive george russell  win   mercedes  lando norris    driver  "
"896"," checkered flag lando norris  charles leclerc clash      racing incident  "
"897","lando norris  charles leclerc clash      racing incident   ricciardo"
"898","cashemiro romanroygoat suryapriv assassinscreed lando norris     "
"899"," lando norris  daniel ricciardo  forced  retire    paulo grand prix      "
"900","lmf  "
"901","misovaris landonorris quadrant  lando norris liked  tweet"
"902","moonlightvani landonorris quadrant  lando norris liked  tweet"
"903","lhhlnor landonorris quadrant  lando norris liked  tweet"
"904","toujourscheol landonorris quadrant  lando norris liked  tweet"
"905","hlianapas landonorris quadrant  lando norris liked  tweet"
"906","quadrant  lando norris liked  tweet"
"907"," formula history repeating  wild conspiracy theory charles leclerc lando norris george russell max "
"908","read       formula history repeating  wild conspiracy theory charles leclerc land "
"909","rosannatennant mclaren suddenly   half decent car  lando norris  smashing   wee cheeky st seei "
"910","norris lando   told    looked hot  im  surprised  "
"911"," history repeat  wild conspiracy theory charles leclerc lando norris george russell max verstappen "
"912","lando norris  redbull thats "
"913","formula history repeating  wild conspiracy theory charles leclerc lando norris george russell max verstappen "
"914","breaking aston martin  terminated lando norris contract"
"915","mclaren midnight rain edit lando norris carlos sainz ferrari"
"916","lando norris describes  health  wellness battles    weight management  sao paulo grand prix world "
"917","oshillex  barista    uhhhhhh    person   fan  lando norris "
"918","thats cool    announce lando norris   th president  "
"919","lando norris  set fastest lap   dutch gp"
"920","woke   wondering   grid   taylor swift lando norris       closet swift "
"921","lando norris   rear tyre puncture      imola grand prix"
"922","  love  driver   admit  theyre wrong  love lando norris   acknowledge  flaws none  "
"923"," lando norris    podium"
"924"," fake  fans   sochi  lando norris    race    respect   greats  th "
"925","angryschumi idk maybe lando norris"
"926","iandowdc    lando norris  ice hockey lmk   start watching       bitch    "
"927","   bad issues  lando norris   crash  charles leclerc    mechanical  ouch"
"928"," shoved lando norris onto pit road"
"929","caught   driver lando norris hypnotized     race    app   pretty easy  snatch "
"930","michaelmasinot jagisinhov llntern  couldve won russia  hes     car    russell nor "
"931","steadynappin lando norris  left"
"932"," day lando norris    win   day ftwt    shambles"
"933","lando norris deserves    own dog damn   schedule "
"934","   look   incident   outboard camera   hes caused  crash    actually und "
"935"," lando norris britishbelgian formula driver         "
"936","orakefi arjunisvibin landonorrisainz formulahrs  look  landos      difference  speed "
"937","lando norris spins    lead   chinese gp"
"938"," karriere mit lando norris rennen  yeahd "
"939","lando norris   drivers     stewards feeling    lack  understanding  racing situati "
"940","saving     time lando norris   girlfriend  "
"941","oshillex  feel  norris fans  loud     defensive     lot        "
"942"," vs  daniel ricciardo   scored    season mclaren   won  alpin "
"943","lando norris actually blaming charles leclerc   crash  absolutely incredible"
"944","tedjkski lhhan   looking  printers  wallmart   son   lando norris started crying  sh "
"945","lando norris blasts  stewards  punishment  leclercincident "
"946"," via wearetherace looking   incident  charles leclerc  lando norris  sund "
"947"," friends bereal feature lando norris  ie  holding   pfp"
"948","lando norris  miss   race   punched     weekend  jordan taylor"
"949"," driver   midfield car    podium  season ladies  gentlemen  lando norris "
"950","     week  fail lando norris      consistent driver   grid  hes  "
"951","lando norris reveals huge silver lining  brazil dnf check ongtgtgt  "
"952","jbbandos thanks    similar  charles  lando "
"953","lando norris   world champion  "
"954","lando norris   race "
"955","lando norris    rest "
"956"," ride onboard  carlos   race start  lap overtake  mclarens lando norris   abudhabigp "
"957","lando norris     people   annoyingly     attempts   cant dislike   "
"958","  love  driver   admit  theyre wrongi love lando norris   acknowledge  flaws none hes "
"959","zolz lando norris     "
"960","fbrooklyn lando norris retired wag "
"961"," karriere mit lando norris rennen  yeahd "
"962","teamlndo mclarenf landonorris     liked  lando norris"
"963","espnf kick verstappen   respect   team   seat  lando norris"
"964"," helmet cam view   crash  charles  norris   interlagos circuit  "
"965"," georgerussell mercedesamgf       lando norris   "
"966","hope  feel  lando lando norris mclaren alien fullsend mixedmedia mclaren papaya "
"967"," karriere mit lando norris rennen  yeahd "
"968","   favourite    favourite driver  lando norris lando norris   british "
"969","toyohtahf     lewis hamilton    debut win   lando norris"
"970"," botched front wing flap adjustment  costs george russell tenths  lap time putting   threat fro "
"971","carlossainz landonorris  lando norris liked  tweet"
"972","teamlndo quadrant landonorris  lando norris liked  tweet"
"973"," piece  bristollive covering lando norris tough weekend    paulo grand prix    read  cli "
"974"," mclaren star   impressed "
"975","im liked  lando norris "
"976","yo lando norris plz   tweet ty"
"977","im liked  lando norris omg "
"978","hilton landonorris waldorfastoria liked  lando norris"
"979","lando norris  max verstappen   team yeah im    considering  destruction itll cause  rb "
"980","xemmavgalen quadrant  lando norris liked  tweet"
"981","vikivelekei quadrant  lando norris liked  tweet"
"982","ricnorrisf quadrant  lando norris liked  tweet"
"983","scenarioseven landonorris georgerussell  lando norris liked  tweet"
"984","katsangelx quadrant  lando norris liked  tweet"
"985","hilton landonorris waldorfastoria  lando norris liked  tweet"
"986","lando norris youre  cutest human    world"
"987","daniel ricciardo    absolutely smoke lando norris boots       smoking  crack "
"988","wearetherace    lando norris  car  basically  tractor     hardly  downforce  straight line speed"
"989","lando norris      stupid  "
"990","fanaticsferrari  reason  lando norris   grand prix wins"
"991","wish lando norris loved  "
"992","fanaticsferrari lando norris   dealing   sick  suppose   couldnt  serious"
"993","lando norris   happen   creeping  twitter      love  landojpg content landonorris"
"994","lando norris    uk  teach   hate verstappen  dont   races  live tv  basicall "
"995","  lando norris liked  tweet"
"996","lando norris  leaving spyker"
"997","supportdr former  driver lando norriss wag"
"998","quadrant snaski ikashh relatingwave eekso butteryhotness scufgaming landonorris elgato  lando norris liked  tweet"
"999","lando norris angelo bastille archibald medicineball ii choose  fighter ig "
"1000"," perez crashes  qualifying robbing lh   chance  improve relegating      grid gr finishe "
