"","text"
"388","george russell  lando norris hilarious postrace interview    "
"389","dont  dare lando norris "
"390","heres landos list   finishes      abudhabigp autosport norris "
"391","mciarenboys fr sometimes   forget    joking  im  wth    remember  lando norris"
"392","lando norris joked hes swapping  trademark          norris  fin "
"393","lando norris probably     bro coudlnt social distance  fucking car  "
"394"," lando norris  low key "
"395","lando norris    quali         car   im happy  struggled  bit  "
"396","maverick lando norris  landonorris maverick topgun ifeeltheneedtheneedforspeed jet airborne flying "
"397","lando norris    badass     wdc       top top racer "
"398","mclaren mcl poster available     sizes   online store   mclaren poster "
"399","optimusfinch lando  talented      russell  dont   wil    champion chuck norris "
"400","benfthomas lando  talented      russell  dont   wil    champion chuck norri "
"401","cm pov lando norris   joined  "
"402","chrislzn wilkomatic enginemode lando norris   podium  season        drivers "
"403","   lando norris    "
"404","lando norris  time    joke     im joking "
"405"," favourite       race win    lando norris"
"406","fanaticsferrari sometimes      hands      race win  lando norris"
"407","podiumdb lando  talented      russell  dont   wil    champion chuck norris  win  race "
"408","lando norris    qualifying         terms  position  admits hes   "
"409"," lando norris  equal cars  charles leclerc     completely smoked  leclerc "
"410","lando norris     bin "
"411","lando norris takes sly dig  charles leclerc  request  george russell  abu dhabi gp "
"412","lando norris   "
"413","tomorrow   hear lando norris wins  abu dhabi gran prix  "
"414","lando norris  am meters    location  rapidly approaching "
"415","im gonna miss  lando norris  daniel ricciardo duo   "
"416","skysportsf lando norris  cant   joke   look     replies "
"417","  loves growing  blossomed   daniel ricciardo  lando norris share  cuddle ahead   "
"418","lando norris  daniel ricciardo post qualifying interview abu dhabi gr  via youtube"
"419","leclercvzn lando norris      death penalty    joke "
"420","mrrlh  tweets happen   catch  partner getting   pics lando norris"
"421","lando norris   biggest puta  "
"422","teamlndo landonorris  lando norris       season whats      logo   account "
"423","wtfofficial   answer  norris ricardo   nonsense   lie      lando  top"
"424","wtfofficial norris  ricciardo  mean lando    win   gap  painful expected      "
"425"," im     accountability competition   competition  lando norris  "
"426","fanaticsferrari    george russell   future world champion  lando norris isnt"
"427"," damon hill  george lando  harry      laps lando norris  george  dont    "
"428","lando perpetually th norris strikes   "
"429","lando norris   focus  getting  win instead  running  mouth"
"430","landosdarling fault   cars starring daniel ricciardo  lando norris produced  zac brown directed  andreas seidl"
"431","lando norris talk        win  race   "
"432"," biggest flex   ive  saying lando norris   piece  shit  day "
"433"," love lando norris"
"434","dont   leclerc lando norris     time race winner times podium sitter  times pole sitter "
"435"," hope mclaren   lando norris   car     wasting  talent competing    weeken "
"436","im gonna  brave    lando norris        top drivers   season "
"437","  ps  lando norris  hes    change    "
"438","damon hill makes     lando norris   positively    mans land  season thats ma "
"439","lando norris  told sky sports    taking      previously   kimi rikknen  abudhabigp"
"440","lando norris     qualified  canada   round   races ago"
"441","lando norris postq interview      thats        putting   laps "
"442","lando    rest norris  "
"443","lando norris   grass"
"444","formula abudhabigp  posiciones finales  max verstappen   checo prez   charles leclerc  "
"445"," lando norris   raf fighter pilot unless      play    name theyd nickname  "
"446","anyway lando norris    rest"
"447","lando norris    rest"
"448","qualifying abudhabigp max verstappen sergio perez  front row start  singapore charles lecl "
"449","fin de la clasificacin  max verstappen sergio prez  charles leclerc  carlos sainz  lewis hamilt "
"450","lando norris     rest"
"451","  separate   lando norris    "
"452","lando norris    rest "
"453","max verstappen takes   pole     sergio perez  charles leclerc carlos sainz  "
"454","abudhabigp qualifying results max verstappen sergio perez charles leclerc carlos sainz lewis hamilt "
"455","lando norris  extraordinary   onelap pace somehow someway hes    conversation   car tha "
"456","max verstappen   pole  tomorrows abudhabigp  sergio perez  charles leclerc  carlos sainz fourth "
"457","red bull ferrari mercedes  lando norris      rest abudhabigp"
"458","lando norris   incredibly romantic relationship  "
"459","lando norris continuing      rest  mclarenf teamlndo"
"460","lando norris finishing   qualifying        rest   "
"461","lando norris      "
"462","lando norris   "
"463","fuck lando norris"
"464","lando norris lap   life  beg"
"465","lando norris   lap   life please"
"466","  lando norris"
"467","  found   am   lando norris honestly dont    feel  "
"468","  grass lando norris"
"469","midwestboxbreak topps  lando norris  podium   season blue parallel psa  "
"470","  believe lando norris   maxs level  hes   unlucky   abysmal mclaren abudhabigp"
"471","lando norris    gravy"
"472","lando norris  sexy motherfucker"
"473","lando norris   papaya car getting    nerve"
"474","hamilton escapes penalty  abu dhabi fp red flag breach hamilton  summoned   stewards following fp  "
"475","lando norris appreciation tweet "
"476","carlos sainz goes quickest overall     teammate lando norris goes nd fastest   abudhabigp"
"477","lando norris "
"478","lando norris goes  fastest "
"479","lando norris    beautiful"
"480","lando norris "
"481","midwestboxbreak lando norris maiden pole topps  sgc shipped "
"482","  max verstappen sergio perez carlos sainz charles leclerc lando norris sebastian vettel geor "
"483","lando norris   explode  minutes "
"484","lewis hamilton fans   else  calling norris  snitch   lewis amp george werent   max  "
"485"," mans  driving  superb laps  weekend lando norris thank "
"486","lando norris races "
"487","bennyman utdyiannis latebrakers    denying  lewis overtook kmag  lando norris     "
"488","utdlewis lando norris    amount "
"489","fastestpitstop lando fricking norris hhahhsfhbhrg"
"490","lando norris   bit  prick isnt "
"491","formulasargeant oscar   love supporting   disliked blokes dont exactly      lando norris  fan base"
"492","lando norris   wetting  pants   abudhabigp "
"493","skysportsf red bull clause invoked  im  lando norris  bitterly disappointed rat"
"494","lando norris    accident  cause  safety car   italian gp"
"495","bvbdani people  moaning  max deserving  penalty     lando norris  trending  tea "
"496"," morning   lando norris "
"497","lando norris   getting death threats tonight  cultlh"
"498","flexing       lando norris "
"499","lando norris spins    lead   german gp"
"500","verschoor  lando norris mate rates   defence"
"501","ijwi wont help lando norris   win  "
"502","knoxy ashiham wtfofficial warra race win  lando norris"
"503","     lewis hamilton id  half inclined   hand lando norris  bill   meal   night "
"504","kvissertweets  barber    people rating lando norris highly"
"505","wtfofficial lando baby  norris"
"506","intelgaming ibuypower formula car  lando norris    video game"
"507","abudhabigp genuine question whos lando norris    heard   hes  won  race   wh "
"508"," paddock     toxic    world allah kiyaye     people dont  lando norris "
"509","hamilton  investigation  overtaking   red flag  fp "
"510","lando norris  wearing  ciao vettel helmet  abudhabigp landonorris sebastianvettel dankeseb "
"511","  landos call sign   "
"512","lando norris  reaction pics  thread  "
"513","enginemode lewis passed lando norris  speed  red flag conditions     suggestion     seen  red flag"
"514","autosport  funny   lh cult  complaining  lando norris  theyd watched      "
"515","fastpitstop yeah  dont understand   lando   guts  call    doing   "
"516","thats  wrap  practice  sergio perez posted  quickest lap time followed  max verstappen  lewis "
"517","lando norris  snitch "
"518"," announce lando norris penalty  snitching"
"519","fayfreddie fastestpitstop       home   obvious  fia  multiple cameras react  "
"520","lando norris  relax      talk "
"521"," redbullracing top british drivers  sir lewis hamilton jim clark sir stirling moss mansell st "
"522"," redbullracing    drivers   common nikita mazepin nicolas latifi rio haryanto lando norris  "
"523","sergio perez led    teammate max verstappen   final practice session    mercedes duo  "
"524","   drivers   common nikita mazepin nicolas latifi rio haryanto lando norris yuji ide sean gelae "
"525","dear lando norris  hope   explosiv diarrhea   race "
"526"," ferraris lagging  lando norris   laugh  cry"
"527","   bit   painful final weekend  ferrari  pace doesnt look    fp stuck th  th "
"528","skysportsf lando norris   grass "
"529","amalshura    drivers   common nikita mazepin nicolas latifi rio haryanto lando norris yuji ide "
"530","  panel  lit   lewis  alongside norris   difference  speed  lewis lando  kevin "
"531","lando norris ur driving   sexy"
"532"," dont wanna mature im happy   am lando norris "
"533","lando norris  worst british driver   grid crying "
"534"," lando  wins norris   concentrate  podiums "
"535","lando norris   fucking snitch snitches  stitches"
"536","albon  destroyed lando norris "
"537","lando norris  deserve  nice"
"538","lando norris  snitch "
"539","  dangerous  lando norris  slow   racing line  albon  approaching   speed abudhabigp fp "
"540","lando norris                "
"541","lewis hamilton   postsession investigation  failing  slow   red flag footage    "
"542","lando pookie norris"
"543","lando norris  fucking god"
"544","lewis hamilton noted   stewards  failing  slow   red flag replays   overtaking lando  "
"545","lando norris   cant  "
"546","lando norris   snitch"
"547","trouble brewing  lewis hamilton lando norris   overtook    track   red flag conditions "
"548","hamilton overtook  haas aswell   red flag lando norris  abudhabigp"
"549","shut   lando norris  piece  shit"
"550","lando norris hamilton overtook  haas     red flag"
"551","lando norris omds"
"552"," lando norris    podium"
"553","fi pic   day lando norris looked      channeled  inner maverick  week   uae wh "
"554","mclaren  race wins lando norris daniel ricciardo "
"555","  season     close  weekend   lights  abu dhabi    luck  lando norris "
"556","srinualways   true landos dad  chuck norris chuck norris  win  race "
"557","wont hear word     media cause  name isnt lando norris uwu  "
"558","lando norris  reported  join starworks   rolex "
"559","liam    practice lando norris     radar"
"560"," chillibadger definately sit  lando norris  sitting"
"561","lando norris    helmet pics wtf "
"562","thank  lando norris   george russell feet pics"
"563","lando norris please drop  photos   helmet "
"564"," lando norris     formula driver  appear   dreams congratulations   appearance "
"565","lando norris fight  "
"566","lando norris     canadian grand prix   power unit issue"
"567","ho   te pieni di lando norris che canta  friday theeeeen"
"568","thursday friday schumacher departs  mclaren lando daniel  "
"569"," exclusive paddy mcguinness enlists help   ace lando norris  top gear host attempts  train  totally  "
"570","lando norris        neck  jaw   okay "
"571","daniel ricciardo chose   stay    grid   lower team    decision     scratchi "
"572"," checkered flag lando norris hoping mclaren  try    step forward tomorrow  danielricciardo "
"573","ashwoody   true landos dad  chuck norris chuck norris  win  race "
"574","lando norris hoping mclaren  try    step forward tomorrow   mclaren"
"575","lando norris hoping mclaren  try    step forward tomorrow "
"576","sebbbasmg   lando norris "
"577","  free george feet pics lando norris "
"578","cerulloharrison hates norris lando mcqueen  "
"579","  georges feet   ig feed lando norris istg"
"580"," swear   lando norris wins  formula ill swing im  max verstapppen fan  life    dutch bastard"
"581"," lando norris    podium"
"582","landooooo lando norris illustrated poster landonorris mclarenf "
"583"," chillibadger  leclerc  lando norris "
"584","lando norris     thank     "
"585"," chillibadger  course  daniel ricciardo  lando norris"
"586","iecirc    lando norris"
"587"," type  britcedes posting     lando norris"
"588","lando norris   silverstone stompers   instagram feed "
"589","liked  lando norris "
"590","  lando norris posting pictures  george russells feet"
"591","rezo fanaticsferrari lando norris   bff"
"592"," pato oward stood   lando norris    session   day  overcame  te "
"593","dragonfruitrb boys  support lando norris  girls"
"594"," lando norris hashad mental health issues "
"595","hello   little presentation     name  mathilde  call  math  prefer   im   broth "
"596"," dont wanna mature im happy   am lando norris"
"597"," topps chrome  sapphire lando norris gold refractor rc   ebay "
"598"," clips lando norris   thecrew  nice story fallout  "
"599","lando norris  maverick "
"600","   dreams   physically fight  lando norris"
"601","mattamys sponsored  lando norris "
"602","yukis halo  grazie pierre  sums   relationship reminded   lot   lando norris  carlo "
"603","mclaren   decent   landonorris    friday practice abudhabigp "
"604","um  lando norris   todays post"
"605"," talk abt  pictures pls lando norris   photographer age im   love god "
"606","lando norris george russell   method drivers    lot enjoyable  sebastian vettels farewell "
"607","lando norris   mistake    lap  soft tires      start  afterwards  theres "
"608","daniel ricciardo  lando norris   tenths    blue cars      watch   bottas "
"609","lando norris  terminal damage  crashing   safety car"
"610","    favorite photographer lando norris   isnt   lando norris ok "
"611","kinda   wear   shirt      basketball meeting     doubt theyd     showe "
"612","osofficialf   true landos dad  chuck norris "
"613","lando norris   swapped   pato  fp   playing  bit  catchup  im   little bit  "
"614","ryanmeaney  lando norris"
"615","cbdoge elonmusk carlos sainz  lando norris"
"616","lando norris  reasonable day  swapped   pato  fp   playing  bit  catchup  im   "
"617"," yourself   looks   lando norris  george russell "
"618","   lando norris idk   explain  "
"619","teamlndo landonorris rafredarrows mclarenf lando norris    top gun movie  "
"620","red arrows ft lando norris redarrows landonorris abudhabigp mclarenf "
"621","sale topps chrome sapphire lando norris formula image variations gold refractors psa "
"622","carlos sainz remains   driver     teams  remain    seasons  despite lando "
"623","hardcastie doesnt actually force junior drivers  practice  rules   prevent mclaren putting lando  "
"624","lando norris raced  takes   practice "
"625","theredflagspod  giving   cant tell  lando norris wasnt  cars kid "
"626","lando norris   suit "
"627","ricciardo fans getting mad     boy    blown   lando norris  wild dont  tha "
"628","lando norris didnt    able        car   free practice"
"629","andreas seidl  lando norris     suffering  food poisoning  brasil"
"630","lando norris sebmet maybe  am  resistant   sad twinkboy charms"
"631","che cuore landonorris  thank  lando dankeseb  abudhabigp norris mclarenf "
"632","lando norris  "
"633","mclarenf landonorris thats absolute class lando norris "
"634","lando norris  thats  driver  "
"635","lando norris  reaction pics  thread  "
"636","  lando norris     "
"637","teamlndo landonorris mclarenf   lando norris     landonorris"
"638"," lando norris mclaren mick schumacher haas  team alexander albon williams  "
"639","helmet design  lando norris   abudhabigp mdm designs jmd helmets ln norris mclaren  formula "
"640","oh lando norris      "
"641","       miss   special helmets  lando norris"
"642","hes talking  pure strength  cause     wrong  argument  women arent strong    "
"643","sigh     follow  tumblr  playdirtystayfair yes    lando norris simp blog mind ur business"
"644","nightmare start  pato oward  hes   lando norris  theres  wrong   car     "
"645","fdarryll  tweet  quoted   article  essentially sports "
"646","serafimalves  tweet  quoted   article  essentially sports "
"647","tripleflops  tweet  quoted   article  essentially sports "
"648","safeforlando  tweet  quoted   article  essentially sports "
"649","thirtyninety  tweet  quoted   article  essentially sports "
"650","teresa  tweet  quoted   article  essentially sports "
"651","formulashlie  tweet  quoted   article  essentially sports "
"652","sennsainz  tweet  quoted   article  essentially sports "
"653","hbwanne  tweet  quoted   article  essentially sports "
"654","xdhav  tweet  quoted   article  essentially sports "
"655","mereeedithh  tweet  quoted   article  essentially sports "
"656","mclarenf  tweet  quoted   article  essentially sports "
"657","nightmare start  pato oward  hes   lando norris  theres  wrong   car     "
"658","lando norris tells  armchair analysts    mouths shut  suzuka chaos mirror formula  "
"659","askpaddypower request  bet   max verstappen  lewis hamilton podium  ferrari top  lando norris  finish"
"660"," nightmare start  pato oward  hes   lando norris  theres  wrong  "
"661","nightmare start  pato oward  hes   lando norris  theres  wrong   car     "
"662"," lando norris    podium"
"663","mclaren  giving  indycar ace pato oward   taste   official  session    laps  th "
"664","leclerc  surprised   contact  norris   brazilgp obviously   lando    type  guy "
"665","lando norris wary   gap  mclaren    carsradars "
"666","  lando norris dont     istg   home   lecture  bam day  "
"667","lilicalloway lando norris   goat"
"668","lando norris     contributions  society  pitting lewis th win  post "
"669","muntaindewpss   im gonna  handed dollars  im gonna kiss lando norris   mouth"
"670","gaslycentral lando norris win"
"671","lando norris wallet designs rip wallet  free postage  free lando norris helmet sticker ideal gift "
"672","thank  lando norris   shots "
"673","alexa play   breath  twitter reacts  lando norris goes airborne   royal air force red arrows "
"674","red arrows ft lando norris redarrows landonorris abudhabigp mclarenf "
"675","    bad  lando norris lando norris   friend "
"676","dragonfruitrb  support lando norris"
"677","    love doing sometimes   maybe      drink  friends   partying  wh "
"678"," twitter  gone tomorrow im   dedicate  final tweet    favorite  lando norris  mcla "
"679","lando norris    fine "
"680","lando norris    overrated driver   grid"
"681","davidowashere  cant believe twitter died  times  lando norris  won races "
"682"," tweet abt lando norris   joke  tbh im seeing   edits   hes slowly     rankings "
"683","lando norris     "
"684"," topps chrome path podium  sportscards ad "
"685","twitter  shut   lando norris won  race "
"686","rest  piece twitter lando norris couldnt    win  twitter died ftwt"
"687","        remembered loving lando norris "
"688","lando norris  grow  "
"689","itsnotlily  handsomeness    stands  despite  bluriness   thank lando norris"
"690","ive  tumblr  five minutes     recommending photos  lando norris    mistake"
"691"," topps turbo attax lando norris csg mint plus iso follow  reply  iso  claim  purchase "
"692","lando norris smiles   brother advice     braces"
"693","thank  lando norris "
"694","avesmanifesting lando norris hes   driver  mclaren"
"695","lastlaplucy kicking latifi   moving  upto norris     sit   lando "
"696","    lando norris  brought  society "
"697","charlesleclerc  wears   outfits charles  lando norris via landojpg "
"698","lando freaking norris ive  loved    photos  fucking elite thank   blessing "
"699","   bcus      lando norris "
"700","super shot  alooficial   lando norris  fernandoalonso alpine astonmartinf abudhabigp "
"701","lando norris  throw   party  world   seen  carlos sainz retires    stripper "
"702","id   thank lando norris  posting  photo    seb  sat   lewis  mick   dinner "
"703","lando norris using charles thirst traps"
"704","lando norris    thank "
"705","lando norristhank    food "
"706"," lando norris   fries "
"707","lando norris thank    service "
"708","lando norris  thank   fucking day  giving   picture "
"709","lando norris thank    "
"710","lando norris im sorry    shittalk    "
"711","thank  lando norris "
"712","   thank  lando norris  "
"713","lando norris youre officially forgiven "
"714","  bit   lando norris girly  finally    quadrant item"
"715","lando norris share  pics  ur camera        im  playing "
"716"," love  max verstappen       cant      lando norris pictures "
"717","       lando norris merch  "
"718","coinbullishish alexmulcrow alebjurkell mattywtf  hasnt forgotten   drive  hes   asset  "
"719","class   seb lando norris   fuck im crying  eyes  "
"720","lando norris   worst teammate ive   robert kubica"
"721"," seb lando norris  "
"722","lando norris  absolutely love   giving    pics "
"723"," lando    type  guy    reason    aggressive charles leclerc  shocked  lando "
"724","lando norris   joining brm"
"725","stilxsherron  dont  tom cruise    lando norris hes  european version      "
"726"," lando norris    podium"
"727","danpan lando norris  im afraid dan"
"728"," match   heaven surely landonorris   mighty rafredarrows  word awesome "
"729","circusracing  tweet  quoted   article  essentially sports "
"730","lando norris driver      "
"731"," lando norris        "
"732","landonorris  rafredarrows  mcclaren driver   pictured   red arrows green coveralls ahead   "
"733","rafredarrows landonorris mclarenf skysportsf ukinuae wing co lando norris"
"734","lando norris scale mini helmet miami basketball race helmet wbox  ebay "
"735","boys  support lando norris  superior"
"736","lando norris     "
"737","teamlndo landonorris rafredarrows  lando norris supremacy "
"738","untouchable unless   hailee steinfeld lando norris  carlos sainz"
"739","lando norris smiling  cheer   timeline "
"740","teamlndo landonorris rafredarrows    call  lando racer norris"
"741","lando norris    doing   "
"742","breaking lando norris  alfa romeo          season"
"743","lando norris helmet complete  kit    friday th  pm gmt  landonorris quadrant  "
"744"," karriere mit lando norris rennen  yeahd "
"745","lando norris signs  haas   "
"746","  formula season nears     reminisce   mclaren mclm  racing challenger    "
"747"," lando norris  shampoo hv   using recently "
"748","lando norris  love    blabber mouth   "
"749","hi   am looking   mutuals  im   twitter  am  fan  max verstappen pierre gasly "
"750"," karriere mit lando norris rennen  yeahd "
"751"," little brother tries     formula  day   dont     lando norris videos   "
"752","lando norris  tom holland kings  spoliers "
"753","mclarenf rafredarrows landonorris lando maverick norris"
"754","people talking  monaco   talk   deliberatecrashes monaco leclerc imola lando  "
"755","    lot  meds    tough saopaulogp weekend  lando norris     doing     "
"756"," thread  lando norris  daniel ricciardo   am   miss   "
"757","lando norris  reaction pics  thread  "
"758","lando norris    meaaaannnnn "
"759","lando norris   speak  rn    mean "
"760","  weetabix  fullfat milk       lando norris  formula landonorris"
"761","landonorris   plenty  energy left  bring  fight  alpine abudhabigp "
"762","alexsaurous dervogel wtfofficial yeah  mentions money   talk  norris  instance event "
"763"," lost   easy  week  lando norris  hes excited  abu dhabi  looks  success  weekend  "
"764","nexoreh itsnotlily ok  lando norris  won   look  hes doing  mclaren"
"765","lando norris  red arrows  ln abu dhabi "
"766"," teams average age      thread  team mclaren  lando norris  "
"767","sporting lando maverick norris   "
"768"," topps chrome sapphire edition formula  lando norris psa  ebay "
"769","oscar piastri   joining lando norris  mclaren  season       risk  "
"770","lando norris   handed  fivefive grid penalty   respecting double waved yellows"
"771","albertopupo   car dealer  sold  ford falcon  lando norris"
"772","red arrows ft lando norris redarrows landonorris abudhabigp mclarenf "
"773","biackfireproofs tom cruise     pilot lando norris "
"774","lando norris  floor damage"
"775","lando norris ready  flight landonorris mclarenf skysportsf redarrows "
"776","     difficult     themselves   shoes   instance lando norris  questioned "
"777"," karriere mit lando norris rennen  yeahd "
"778","mood  love  lando norris  profile "
"779","lando norris  carlos sainz playing golf   fathers  "
"780","mclarenf rafredarrows landonorris  name  norris lando norris "
"781","lando norris saving  day fr fr "
"782","lando norris  red arrows  "
"783","megavsprimus mattywtf  guy aint     theres  fight  whos   driver  mclaren  lando norris   mile"
"784","lando norris   red arrows wowza "
"785","mclarenf rafredarrows landonorris lt lando streamer norris"
"786","lando norris reporting  duty landonorris abudhabigp "
"787","formularacers seb  mick  audi  build  car   seb eventually retiring    brit called la "
"788","ffan true especially  lando norris  holding "
"789","lando norris  announced  retirement"
"790","mclarenf rafredarrows landonorris  season plans confirmed lando norris  eras tour "
"791","lando norris fans following     tweet  hate  dont "
