"","text"
"1","sergio perez   fucking push    coward"
"2","red bull racing added   championship success  final  race weekend  max verstappen     "
"3","  fight   championship     race     little   sergio prez "
"4","allthatglitz drobbs    arguments run    memes  leave   leclercs own opinion  "
"5","jeremy clarksonhas calledmax verstappena spoiled entitled brat    column  formertopgearpres "
"6"," lineup red bull max verstappen sergio perez ferrari charles leclerc carlos sainz  "
"7","leclerc   drivers championship     finish  ferrari  team championship congratulations  "
"8","   feeling  sergio perez doesnt    fuck    loser  "
"9","top drivers   championship  max verstappen charles leclerc sergio perez  racecrate "
"10"," red bull       terms     updates     rb losing weight costs "
"11","carlos sainz max verstappen charles leclerc sergio perez lewis hamilton surprise alfa romeo victory "
"12","  sergio perez  yesterdays abudhabigp means  charles leclerc  runners  spot   champio "
"13","twommof    weekend charles team  aston martin    weekend sergio perez  am sorry     "
"14","sergio perez rb   commentary  view  pit lane  via youtube schecoperez redbullracing silverstoneuk"
"15"," sergio perez started strong     season       finished    champi "
"16","         sergio perez    driver    exceptional   tra "
"17"," sergio perez  unable  match max verstappen   battle   world championship  red bull boss "
"18","monday morning sportmphmarks post race analysis thats       takes  look    "
"19","   wallpapers   nights podium   abudhabigp max verstappen charles leclerc amp sergio prez   "
"20","max verstappen  explained   didnt block charles leclerc  help sergio perez   abudhabigp   "
"21","red bull finishes   season    victory unfortunately sergio perez   settle  third "
"22","   sergio checo perez   simply  destroy  sets  front tyres   faster   abu dhabi "
"23","max verstappen cruised  victory  abudhabigp  ferraris charles leclerc    finish ahead  sergio "
"24","redbull giving massive discounts  sergio perez merch rn "
"25"," christian horner    sergio perez   chance  challenge max verstappen  th "
"26"," ferrari  revealed     dummy radio message  trick red bull  putting sergio perez    tw "
"27","  drivers  driver   day  season max verstappen charles leclerc sebastian vettel lewis "
"28","sergio perez   beaten charles leclerc   teammate      abudhabigp  red bull  "
"29","ferrari  charles leclerc   dummy radio message  forced red bull  opt   stop strategy  sergio perez  abudhabigp"
"30"," battle   pride    fs drivers championship   tactical affair  charles leclerc "
"31","milton keynes  run  list   run acts  max verstappen  sergio perez  nas "
"32"," saturday december max verstappen sergio perez  christian horner    red bull racing rb   "
"33","ferrari   dummy radio message  push red bull  pitting sergio perez    time   abudhabigp "
"34","katiiamunguia schecoperez remember    ago sergio perez   cut   team   facing  "
"35","sergio perezshould accept   red bulls   driver behindmax verstappenor leave  team according  "
"36"," guy  unbelievable   true egocentric colors    perez     sergio "
"37","redbullracing maxverstappen vladimirrys  dominant performance   dominant season  super max  goat  "
"38","sergio perez        abu dhabi gp despite ultimately coming  short   fight    "
"39","  top spot   drivers  teams   sealed   abudhabigp ferrari finished nd   "
"40","    start  finish charles leclerc hails  perfect race   beat sergio perez     "
"41","max verstappen  seized  final pole position      blistering lap  qualifying   seasonen "
"42","sergio prez moving past brazilian gp drama  max verstappen    "
"43"," surviving   war  sergio perez charles leclerc warns champion max verstappen   seas "
"44","helmut marko blames sergio perez mistake  red bull losing  ferrari  abu dhabi  sport dutchnews "
"45","sergio perez spins    lead   italian gp held  imola"
"46","khalilracing schecoperez checopereznews aguirrealuis checo   happen   season sergio prez worl "
"47","carlossainz  start theabudhabigrandprix  fourth   grid    directly  ferrari teammat "
"48","top searches  netherlands   qatar  wk  sebastian vettel  noppert  benzema  nederland "
"49","red bulls max verstappen won  final race   season  abu dhabi  ferraris charles leclerc beat  dutch "
"50","   season ratings  red bull max verstappen sergio perez ferrari charles leclerc  "
"51","sergio perez cheated   wife max verstappens mum accusesmexican "
"52","max verstappen letting sergio perez  wouldnt   nicest   finish "
"53","checolover  ago sergio  cut   aston     seb   perez  doing    "
"54","helmut marko makes statement blames sergio perez red bull loosing nd spot  charles laclerc wow heres  stateme "
"55","  possibly block   mean   fair racing     nicest      championshi "
"56","abu dhabi grand prix max verstappen red bull   willing     help sergio prez  itfair "
"57","helmut marko blames sergio perez mistake  red bull losing  ferrari  abu dhabi express "
"58","verstappen held   teammate sergio perez   start  didnt   serious challenge     se "
"59","redbullracing sergio prez im proud          schecoperez"
"60","max verstappen blames red bull  sergio perez misses  toleclerc "
"61","sergio perez topps chrome sportscards sponsored "
"62","fantastic sergio perez  fell short  luck  season"
"63","abu dhabi grand prix max verstappen red bull unwilling  help sergio prez  itfair "
"64"," millions  eyeballs focused   world cup heres   favorites    globe  superb "
"65","  possibly block    fair racing  cant believe max verstappen actually    exactly "
"66","redbullracing     donea   retirements   doubters   rate  team cam "
"67","max verstappen blames red bull  sergio perez misses   charles leclerc  "
"68","sergio perez radio brazil max       via youtube wrong verse rig "
"69","sergio perez told   leave red bull  max verstappen feud isnt dropped "
"70","sergio pereza famous tyre management abilities  completely missing    awful    tyres"
"71","dnsmiffdavid redbullracing      onlu tema player  prez max  champion    "
"72","max verstappen  won  abudhabigp ahead  charles leclerc  sergio perez leclerc finishes  season seco "
"73","max verstappen  won  abudhabigp ahead  charles leclerc  sergio perez leclerc finishes  season seco "
"74","people  offended  logan  pro trump comments    ago  gonna tell  carlos sainz  "
"75","teammate sergio perez found  harder   collapsed heavily   medium tires       servic "
"76","fatbertt   drive  survive  sergio perez   hero pls"
"77","max verstappen    snub sergio perez overtake   coulthard "
"78","teammate sergio perez    mexican pushed  pirellis harder  weekend anyway     th "
"79","amus  world champion  goodbye   winter break   win red bull  unbeatable  abu dhabi   "
"80","mx news abu dhabi grand prix max verstappen wins  sebastian vettel scores   final race red bulls ma "
"81","fernhdez formulamatt dont  lot  mexicans hate antonio perez garibay    withdraw  bit esp "
"82","charles leclerc secured     championship narrowly beating rival sergio perez   tight tactical  "
"83","sergio perez  improvement     shown  weaknesses    nearly    pace "
"84","sergio perez    verstappen instead   usual "
"85","max verstappen blames red bull  sergio perez misses   charles leclerc  nd  teamwork    "
"86","helmut marko reveals overtaking maneuver  hamilton cost sergio perez    drivers championship "
"87","wow   team  arseholes   verstappen redbullcheats sergio perez told   leave red bull  "
"88","hes    competitor christian horner applauds charles leclerc  piping sergio perez     drive "
"89","max verstappen won  final race   season   abudhabigp  ferraris charles leclerc beat  dutchmans "
"90","talksport youre talking rubbish   verstappen    position  perez  brazil sergio   "
"91","youre talking rubbish   verstappen    position  perez  brazil sergio    finis "
"92"," sergio prez delirious hes     drs   laps    max  abudhabigp "
"93","  sergio perez  dont  max verstappen checo   outstanding max   spoiled selfish prick  "
"94","sergio perez   red bull rbb honda rah qualifying  lusail  qatargp photo hondaracingf "
"95","sergio checo perez    world champion"
"96"," yearold verstappen dominated  start  finish    unable  assist  red bull teammate serg "
"97","max verstappen letting sergio perez  wouldnt   nicest   finish  looking   "
"98"," charlesleclerc wella sergio perez   decent team mate         maybe  sh "
"99","wait sergio perez   clinched nd overall  max     pass    race lmaooooooooooo"
"100","sergio perez signs  mclaren   "
"101","sergio perez settles  third  abu dhabi "
"102","max verstappen admits   retire  formula   contract  red bull comes    "
"103","redbull maxverstappen schecoperez redbullracing verstappen   real shit   human     teammate "
"104","max verstappen finishes  top  charles leclerc claiming  brilliant nd  sergio perez russell  "
"105","max verstappen      hold  charles leclerc  help   red bull team mate sergio perez  "
"106","dr sultan al jaber awarded    trophy  charles leclerc  abdulla khouri awarded  third   "
"107"," near     sergio perez      championship result   career "
"108","sergio perez fans  hating pierre gasly  fanbase   unbelievably toxic "
"109"," abu dhabi gp sergio perez sometimes  win  sometimes  lose    ferrari  charles  "
"110","posted withrepost    final standings   season  charles leclerc beats sergio perez     "
"111","max verstappen     slow   sergio perez         nicest    "
"112"," helmut marko believes   mistake cost sergio perez time   abudhabigp   mexican missed   "
"113"," abu dhabi gp postrace pres conference  drivers max verstappen red bull racing "
"114","sergio perez  red bull  max verstappen     hindrance   crucial stage   "
"115","charles leclerc  able  hold       abu dhabi grand prix ahead  sergio perez    "
"116","sergio perez  stuck  teammate max verstappen   abu dhabi   stint   wake  knockon ef "
"117","formula carrera podio max verstappen red bull charles leclerc ferrari sergio perez red bull "
"118","abu dhabi grand prix max verstappen beats sergio perez  pole position  "
"119","abu dhabi grand prix fia  shy  investigating sergio perez monaco crash  "
"120"," hasnt   praise  ferraris strategy team   pitwall    italian team    "
"121","sergio perez   am pleased             didnt    hurts  "
"122"," sergio perez   max verstappen inadvertently cost  time   abudhabigp   red bull drivers ra "
"123"," season finale  max verstappen breeze  victory  charles leclerc locking    championship ahe "
"124","     championship  sergio perez "
"125","    fake  fans  sergio perez coming home third ultimately       gain "
"126","maxverstappen redbullracing hondaracingglb   grateful  sergio perez "
"127","   faced   prospect     dying fly      stint   try  attack  cho "
"128","sebastian vettels formula career     brilliant drive  finish    finale  abu dhabi "
"129"," sergio perez coming home third ultimately       gained   red bulls swapped posit "
"130","sergio perez   died towards      stint   abudhabigp    strategy tricky "
"131","formula season driver standings  max verstappen  charles leclerc  sergio perez constructor standings "
"132","thank  max verstappen  thank  sergio perez  thank  red bull racing  thank  rb    "
"133","termina la temporada en de la  yas marina el escenario para la final el campen del mundial max verstappen  "
"134","maxverstappen redbullracing hondaracingglb im looking forward  seeing sergio perezs villain era   checoperez "
"135","max verstappen claims recordextending th victory  season finale  abu dhabi grand prix charles leclerc pippe "
"136","perez   close  finishing    constructors championship   fell     heres   "
"137","max verstappen signed    dominant     won   world championship   recordexte "
"138","sergio perez   missed    runnersup spot   drivers championship   red bull driver  "
"139","sergio perez told   leave red bull  max verstappen feud isnt dropped  wow  wow"
"140","ferraris charles leclerc  hed   cent   abudhabigp  sunday   successfully scooped  "
"141","  matters      sergio perez reflects   final race   season   narrowl "
"142","diegoalonsof schecoperez  sergio perez coming home third ultimately       gained  "
"143","max verstappen dominates  pole   recordextending th win   charles leclerc holds  sergio "
"144","red bulls max verstappen wins  abu dhabi  charles claims   championship ahead  sergio perez "
"145","diegoalonsof maxverstappen  sergio perez coming home third ultimately       gained "
"146","live  news max verstappen booed  abu dhabi win closes season costs red bull onetwo finish  drivers "
"147","          sergio michel prez  "
"148"," charles leclerc  revealed  trickery ferrari deployed   abudhabigp  fooled sergio perez    "
"149","abu dhabi gp sebastian vettel scores    final race charles leclerc beats  sergio perez amp ferrari tr "
"150","sergio perez looked  wellplaced  complete   red bull  drivers championship   abudhabigp "
"151","  biggest  driver   world according   book max verstappen sergio perez george russell ca "
"152"," stopped sergio perez    nd position   championship  vote below   formula abudhabigp "
"153"," world annoyed  max verstappen   loss  red bull teammate sergio perez  abudhabigrandprix "
"154"," real  championship based  driver   day results driveroftheday  wtfofficial st max verstappen "
"155"," charlesleclerc sergio prez thank  max    world   generous prick     "
"156"," verstappen  angry  people  yelling   family        ok "
"157","max verstappen    th win     charles leclerc beat sergio perez     drivers "
"158","scuderiaferrari  biggest  driver   world according   book max verstappen sergio perez george "
"159","abu dhabi sergio perez outpaced red bull teammate  world champion max verstappen  setting  fastest time  "
"160","dominant verstappen clinches th win  abu dhabi  charles leclerc wins nailbiting fight  sergio perez  "
"161","eyo sergio perez dont  help    "
"162","thereisnoif sergio prez red bull       capable  managing  supporting max  "
"163","watanonsense george russell  sergio perez lol"
"164","hamiltons eventful  lap  abu dhabi "
"165","  biggest  driver   world according   book max verstappen sergio perez george russell ca "
"166","scuderiaferrari charlesleclerc carlossainz  biggest  driver   world according   book max ve "
"167"," season drivers championship standings   max verstappen charles leclerc sergio perez "
"168","redbullracing maxverstappen thanks  red bull   bad strategy  sergio prez     runs  "
"169"," maxverstappen  biggest  driver   world according   book max verstappen lewis hamilton  "
"170","max verstappen won  abu dhabi grand prix extending  record  race wins   season ferraris cha "
"171"," final top  drivers  max verstappen sergio perez charles leclerc george russell  "
"172","max verstappen enjoys lights  flag victory  charles leclerc  ferrari deny red bull  sergio perez  run "
"173","formula   instagram  final top   charles leclerc beats sergio perez   whilst sebastian vet "
"174","  abu dhabi gp max verstappen  charles leclrec  sergio perez   race  sebastian vettel danke legend"
"175","top results  abudhabigp  max verstappen  charles lerlerc  sergio prez constructions standing "
"176","red bulls max verstappen wins  final race   season  abu dhabi  ferraris charles leclerc beats sergio "
"177","sergio perez postrace interview    degradation  predicted   medium  wasnt able  push  "
"178","max verstappen won abudhabigp  red bull ahead  charles leclerc  sergio perez"
"179","abu dhabi grand prix max verstappen beats sergio perez  pole position grandprix sergioperez abudhabi "
"180"," abudhabigp donut max verstappen amp charles leclerc amp sergio perez gt  formula "
"181","zaimedez perezva redbullracing dit  follow sergio    started  formula     "
"182"," final win    max verstappen   bad   charles leclerc secures    champ "
"183","red bulls max verstappen dominated formula  abu dhabi grand prix   charles leclerc held  se "
"184","sergio perez  lost  championship    selfishness  max verstappen schecoperez skysportsf "
"185","formula   instagram win    super max  charles leclerc holds   charging sergio perez "
"186","max verstappen wins  abu dhabi gp   red bull  charles leclerc nd   ferrari amp sergio perez  "
"187","fia   biggest  driver   world according   book max verstappen lewis hamilton george russ "
"188","toolithandle  spirit  leclerc  defend nd nd   sergio perez towards      day  "
"189"," charles leclerc secured    world championship  finishing ahead  sergio perez   abudhabigp "
"190","sergio perez postrace radio oh   shame    result   season rbr    fight "
"191","  honest max cost sergio perez      stunt  race"
"192"," wonder  christian horner feels  max verstappen  letting sergio prez pass  brazil   charle "
"193","max verstappen wins   race     charles leclerc  sergio perez carlos sainz  "
"194","red bulls max verstappen wins  final race   season  abu dhabi  ferraris charles leclerc beats sergio "
"195"," watch  charles verstappen  perez perform donuts   grid  stepping    car  huge cheers  "
"196","max verstappen wins abu dhabi grand prix charles leclerc finish nd  sergio perez finish rd  completed   "
"197","congratulations  max verstappen  winning  abu dhabi formula  grand prix   followed  charles "
"198","sergio perez  looked   straight forward task  sergio   stopping twice didnt help  race  "
"199"," championship  abudhabigp driver  max verstappen  pts red bull  charles leclerc  "
"200","   sergio perezs fault   didnt finish     fucking rocket ship  season  blew    times"
"201","red bulls max verstappen wins  final race   season  abu dhabi  ferraris charles leclerc beats sergio "
"202","sergio perez       purely   facilitator"
"203","max verstappen   abudhabigp win  charles leclerc secures   sergio perez sebastian vette "
"204","carlos sainz driver   season followed  leclerc followed  sergio perez"
"205","podium  ethiadairways abudhabigp   max verstappen  red bull racing  charles leclerc   "
"206","sergio perez looks   little lego "
"207","charles leclerc   charles leclerc managed  hold  sergio perez      championship sergio pere "
"208","sergio prez  didnt feel   goodbye  vettel charles leclerc  dont      "
"209","mohlalegcr top drivers   season max verstappen sergio perez max verstappen max verstappen finished drivers"
"210","charles leclerc beat sergio perez      abudhabigp   final drivers standings red bull   "
"211"," drivers championship standing  todays race result     deserving   max verstappen  cha "
"212"," max verstappen  charles leclerc  sergio prez elevenf abudhabigp "
"213","andy vermaut sharesabu dhabi grand prix max verstappen wins  sebastian vettel scores   final race red "
"214","pagelle  max verstappen charles leclerc sergio perez george russel carlos sainz lewis hamilt "
"215","redbullracing   amends  sergio perez   childish  stupid reaction max   brazil"
"216","thats  heres  final podium    max verstappen charles leclerc sergio perez  "
"217","thats    abudhabigp    race   max   charles leclerc  nd  sergio perez  "
"218","race report red bulls max verstappen completed  historic season   final win   abudhabigp    "
"219","congrats  sergio perez charles leclerc george russell carlos sainzand lewis hamilton   seasons   formula"
"220","fanaticsferrari  biggest  driver   world according   book max verstappen lewis hamilton geo "
"221","nbsportug max verstappen winning  abudhabi grand prix    congs   teammate sergio perez  finished "
"222","gasly  albon cost sergio perez      final laps potentially   real shame  checo abudhabigp "
"223","formula etihad airways abu dhabi grand prix corrida max verstappen charles leclerc sergio perez "
"224","vamos charles leclerc charlesleclerc    drivers championship  sergio perez "
"225","max verstappen finishes     th race win meanwhile charles leclerc crosses  line ahead  sergio "
"226","  dominant win  max verstappen  th    season   abudhabigp  red bull  "
"227","hello  welcome   addition   max verstappen post race cool  pod cast todays guests    "
"228","formula round abu dhabi gp race max verstappen charles leclerc sergio perez th win  max verstappe "
"229","heartbreak  checo    achievement  leclerc ferrari deny red bull  record finish  leclerc "
"230","    max verstappen  cost sergio perezs    championship      amazing    "
"231","redbull maxverstappen skysports   gall    sergio perezafter selfishly taking    "
"232","maxverstappen  redbullracing wins  abudhabigp  leclerc  nd followed  sergio perez    "
"233","venner xlevityyx skysportsf championship winning season  style   expense  mexican driver sergio  "
"234","maxverstappen  redbull racing    lot  answer  sergio perez    race  potentially  "
"235"," feel red bull  max verstappen     lot   help sergio perez        "
"236","stanreport  perez sacrificed  entire race  season   max  chance  lesson learned  sergio"
"237","     sergio perez   season youve   "
"238","   max verstappen   victory  nd championship  charles leclerc   sergio pr "
"239","charles leclerc  ferrari drove  perfect race  secure     constructors  drivers champion "
"240","round abu dhabi grand prix results max verstappen charles leclerc sergio perez fastest lap lando nor "
"241","red bulls max verstappen won  final race   season  abu dhabi  ferraris charles leclerc beat  dutch "
"242","   max verstappen   victory   championship  charles leclerc   sergio "
"243","cant help  feel sorry  sergio perez     team   "
"244","max verstappenhas won  abu dhabi grand prix butred bull racingcouldnt secure onetwo   world cham "
"245","breaking max verstappen wins  abu dhabi grand prix ahead  charles leclerc  sergio perez  dutchman  "
"246","sergio perez fucked       wdc   teammate   abudhabigp"
"247","charlesleclerc clinches    world championship  holding   hard charging sergio perez   line "
"248","max verstappen wins  abu dhabi grand prix ahead  charles leclerc  sergio perez  race   lot  fi "
"249"," verstappens selfishness  brazil cost redbullracing  sergio perez     championship  skyf abudhabigp"
"250","sergio perez finishing rd   championship purely   team mate wouldnt   past  race  "
"251","max verstappen  letting sergio perez pass  inter lagos decided  standing   drivers standing abudhabigp"
"252","sergio perez villain arc  ferrari   happen"
"253","max verstappen wins  abu dhabi gp charles leclerc holds    securing    drivers championship  "
"254","abu dhabi grand prix race results max verstappen red bull winner charles leclerc ferrari  ser "
"255","max verstappen   abudhabigp win  charles leclerc secures   sergio perez sebastian vette "
"256","sergio perez       times missing      drivers       clo "
"257","sergio checo perez    biggest disgrace  sporting history"
"258","bbcf stuff  stoker  rey  sergio perez  win  dor beat charles le clerc"
"259"," podium  yas marina  max verstappen charles leclerc sergio perez abudhabigp  racecrate"
"260","redbullracing maxverstappen   able  help sergio prez       demonstrated  hi "
"261","max verstappen maxverstappen       crucial listen  redbullracing     positi "
"262","max verstappen  won  abudhabigp ahead  charles leclerc  sergio perez leclerc finishes  season seco "
"263","redbullracing schecoperez   able  help sergio prez       demonstrated   pr "
"264"," love   max verstappen  looks    care  sergio perez congratulations  max  winning "
"265","   nice  sergio perez  finish    drivers championship  max verstappen  fk tha "
"266","max verstappen wins   th time   charles leclerc holds   ahead  sergio perez  takes   "
"267","abudhabigpde zafer max verstappenin  charles leclerc  sergio perez"
"268","charles leclerc claims nd    abudhabigp  overall   drivers championship  absolutely  "
"269","skysportsf red bull  max blew    championship   week      tried  "
"270","im   redbullracing pretending    fuck   happened  sergio perez "
"271","ferraris charles leclerc beats red bulls sergio perez   battle     abudhabigp "
"272","fjordan official maxverstappen screwed redbullracing sergio perez   "
"273"," lap  lewis hamilton  time  backmarkers  proved   crucial  sergio perez  charles  "
"274","max verstappen wins  th race   season   amazing season  round   red bull leclerc comes home "
"275","wonder  sergio perez  red bull feel   failing   perez  finish nd   max verstappen wasn "
"276"," max verstappen charles leclerc sergio perez carlos sainz george russell lando norris esteban  "
"277","congrats  charles leclerc  winning  wdc  sergio perez"
"278","  sergio perez   race   drivers championship     sebastian vettel   final  race "
"279","abudhabigp results max verstappen charles leclerc sergio perez carlos sainz george russell land "
"280","redbullracing schecoperez max verstappen  sergio prez  help  abu dhabi ill  "
"281","charles leclerc finishes ahead  sergio perez   track    championship redbullkarma abudhabigp"
"282","thats  real   sergio perez     overall  abudhabigp "
"283","charles leclerc secures     championship narrowly beating sergio perez   season finale  abu "
"284"," season finale  max verstappen charles leclerc sergio prez red bull   dominant  season   "
"285","pole position   th victory    season  double world champion max verstappen charles leclerc "
"286","world champion max verstappen won  seasonending abudhabigp ahead  ferraris charles leclerc  red bull teammate sergio prez ssf"
"287","red bull   screwed sergio perez  "
"288"," sergio perez officially  screwed      standings     mark webber treatment  th "
"289","redbullracing  theyd help sergio perez  abu dhabi   "
"290"," official max verstappen cost sergio perez nd    championship abudhabigp"
"291","max verstappen wins  abudhabigp  huge credit   charles leclerc  sergio prez leclerc performed "
