"","text"
"898","  recent weeks  team  max verstappen  sergio perez  encountered   stumbling blocks  paddo "
"899","sergio perez   family  lewis hamilton fans  top funniest    time"
"900","fia president makes investigation guarantee  max verstappen spat  sergio perez "
"901","liam lawson   impressive fifth    practice outing  red bull  friday   couple  tenths  "
"902","liam lawson   impressive fifth    practice outing  red bull  friday   couple  tenths  "
"903","   titles decided  main focus  shifted   runnerup fight  sergio perez  charles lec "
"904","formula  governing body  fia  prepared  investigate  sergio perez deliberately crashed  monaco  "
"905","tobi gruener helmut marko  confirmed  skysportformel  ricciardo   rd driver    red bu "
"906","abu dhabi grand prix fia  shy  investigating sergio perez monaco crash  "
"907","abu dhabi grand prix fia  shy  investigating sergio perez monaco crash "
"908","fia willing  investigate sergio perezs monaco crash  complaint   "
"909"," max verstappen sergio perez  securing "
"910","abu dhabi grand prix fia  shy  investigating sergio perez monaco crash  "
"911","  ride  jacob   straight pipes  formula driver sergio perez  red bull racing   allne "
"912","live  news abu dhabi grand prix fia  shy  investigating sergio perez monaco crash "
"913","abu dhabi grand prix fia  shy  investigating sergio perez monaco crash  "
"914","andy vermaut sharesabu dhabi grand prix fia  shy  investigating sergio perez monaco crash formula  gov "
"915","abu dhabi grand prix fia  shy  investigating sergio perez monaco crash "
"916","abu dhabi grand prix fia  shy  investigating sergio perez monaco crash   perez"
"917","abu dhabi grand prix fia  shy  investigating sergio perez monaco crash bbc sport "
"918","abu dhabi grand prix fia  shy  investigating sergio perez monaco crash "
"919","fia willing  investigate sergio perezs monaco crash  complaint    via planetf "
"920"," fia       investigating       untoward  sergio perezs cras "
"921","sergio perez  dinner    stories thanks guys  happy retirement seb  "
"922","   sergio perz    ricciardo  verstappen  teammates  "
"923","sergio perez   sao paulo team  row   involved max verstappen  red bull    hand "
"924","max verstappen   fair team player  red bull lift lid  sergio perezdrama "
"925","context red bulls claim max verstappen  told   position   sergio perez    laplast "
"926","top searches  austria   wann ist black friday  digitaler fhrerschein  banksy  vicky leand "
"927","sergio perez  car          sessions     morning   "
"928"," fia     prepared  investigate    sergio perez deliberately crashed   formula  "
"929"," fia  currently investigating  controversy   accident  sergio perez   monaco gp  "
"930","  transparency      sergio perez   time   fia     initiate  "
"931"," controversy   accident  sergio perez   monaco gp   noted   fia   hav "
"932","sergio perez    max verstappen relationship  reacts  deliberate crashclaim "
"933"," obviously regret  lot       race   am   max   relationship    "
"934","stoffel vandoorne   worst driver ive  raced  sergio perez"
"935","max verstappen  red bull  hit   online threats  abuse leveled   world champion   family  "
"936","   stupid carlos sainz piles onto sergio perez monaco gp conspiracy  simple explanation "
"937"," fia       investigating       untoward  sergio perezs crash "
"938","cnn max verstappen  red bull  hit   online threats  abuse leveled   world champion   fam "
"939","  investigation  planned  fia    prepared  look  sergio perezs crash  monaco gp quali "
"940","maxverstappen im looking forward  seeing sergio perezs villain era   smart ass checoperez "
"941","cnn max verstappen  red bull  hit   online threats  abuse leveled   world champion   fam "
"942","sergio perezs  abudhabigp qualifying position     amp  photo redbullracing "
"943","perez learns  fia  launch investigation  verstappen bustup  sergio dont county "
"944","cnn  max verstappen  red bull  hit   online threats  abuse leveled   world champion  hi "
"945","lei  lighting azukiofficial   joining max verstappen  sergio perez    season finale  abu dh "
"946","max verstappen  red bull  hit   online threats  abuse leveled   world champion   family  "
"947","sergio perez raced  takes   practice "
"948","sergio perez  set fastest lap    gp"
"949","  hour  gone   max verstappen  fastest ahead  george russell charles leclerc lewis hamilton "
"950","  reason   verstappen fans  thank sergio perez   duties        "
"951","max verstappen tops fp    george russell  charles leclerc lewis hamilton  sergio perez    "
"952"," max verstappen tipped  throw toys    pram  demand sergio perez  replaced "
"953","  reason   verstappen fans  thank sergio perez   duties        "
"954"," people    defend sergio prezs moral integrity    max verstappens despicable lies  wor "
"955"," max verstappen tipped  throw toys    pram  demand sergio perez  replaced "
"956","max verstappen tops free practice     soft compound tyres  faster  george russell "
"957","sergio perez nd  drivers  ferrari nd  constructors   abudhabigp formula"
"958","leighogorman dont worry  spread     scribes "
"959","max verstappen  abuse  family  unacceptable following  paulo grand prix  "
"960"," cant     usa exclusive  uk   sister loves forumla racing   likes sergio prez "
"961","abu dhabi gp practice sergio perez  sec slower  teammate max verstappen  identical car  soft pir "
"962"," formula abudhabigp fjp practice fp  remaining time minute posdrivergaptyres   "
"963"," sergio perez     purpose  monaco    banned    forever  flavio briatore formula "
"964","sergio perez   softs crosses  line    teammate"
"965","max verstappen tipped  throw toys    pram  demand sergio perez isreplaced "
"966","max verstappen  abuse  family  unacceptable following  paulo grand prix "
"967","helmut marko  confirmed  sky sports  daniel ricciardo   rd driver    red bull sergio  "
"968","max verstappen  abuse  family  unacceptable following  paulo grand prix "
"969","max verstappen  abuse  family  unacceptable following  paulo grand prix max verstappen  red bull  "
"970"," final fp session   season  complete    drivers     chance  rookie "
"971","max verstappen  red bull  hit   online threats  abuse leveled   world champion   family  "
"972","brianmado    mean  ricciardo realistically  soccer terms       quad player supers "
"973","max verstappen  abuse  family  unacceptable following  paulo grand prix "
"974","max verstappen  reaction  team  controversy unacceptable  disgusting  "
"975","null max verstappen  abuse  family  unacceptable following  paulo grand "
"976","null max verstappen  abuse  family  unacceptable following  paulo grand "
"977","max verstappen  abuse  family  unacceptable following  paulo grand prix "
"978","max verstappen  abuse  family  unacceptable following  paulo grand prix "
"979","max verstappen  red bull  hit   online threats  abuse leveled   world champion   family  "
"980","max verstappen  abuse  family  unacceptable following  paulo grand prix gt "
"981","lei  lightning azuki    firstever nft featured   formula race car   nft   sh "
"982","       thats fine  max verstappen  dont    family    ju "
"983"," ralf schumacher recently     imagine  sergio perez    dri "
"984","    surprised  sergio perez    red bull   theyve apologised  "
"985","red bull racing bring daniel ricciardo  home  presence   pressure  sergio perez    "
"986","max verstappen  attacked  media    termed sickening  unacceptable news reports  follows "
"987","max verstappen  attacked  media    termed sickening  unacceptable news reports  follows "
"988"," minutes fp class sergio perez remains  fastest driver  fp   minutes   session   "
"989"," minutes fp class sergio perez remains  fastest driver  fp   minut "
"990","contract  sergio perez runs  "
"991","helmut marko  confirmed  skysportformel  ricciardo   rd driver    red bull contract wi "
"992"," lewis hamilton topped  timesheets  fp   abudhabigp  charles leclerc  sergio perez exchange "
"993","bascanvas maxvercatering catorrex skysportsf  forgetting nelson piquet  michael schumacher  sergio "
"994","redbullracing  speak        sergio perezs seat"
"995","sergio perez   tenths faster    rookie  "
"996"," minutes fp class sergio perez remains  fastest driver  fp   minutes   session   "
"997"," minutes fp class sergio perez tops  charts    abu dhabi  abudhabigp  "
"998"," session   liam lawson   couple  tenths  sergio perez    driving  red bull  "
"999"," pretty strong fp rookie performances yes    cars  liam lawson   touch  sergio pe "
"1000","  mercedes     fp  lewis hamilton ahead   weeks winner george russell    "
