"","text"
"292","max verstappen winsssssssssss  abu dhabi grand prix ahead  charles leclerc  sergio perez  ffinale abudhabigp"
"293","  checo  proud  rd   wdc  love sergio prez lt"
"294","charles leclerc finishes ahead  sergio perez  takes     drivers standings  mega effort  hold pe "
"295","maxverstappen   cost sergio perez   "
"296","  charles lecler  finishes nd   championship despite sergio perez   faster car  season "
"297","abudhabigp final results max verstappen red bull charles leclerc ferrari sergio perez red bull  "
"298","max verstappen crosses  line  win  abudhabigp  charles leclerc  sergio perez carlos sainz comes ho "
"299"," sergio perez loses   becuase  max lol  formula abudhabigp  redbull"
"300","abudhabigp final results max verstappen red bull charles leclerc ferrari sergio perez red bull  "
"301","max verstappen wins  abudhabigp charles leclerc holds   late charge  sergio perez       "
"302","mental  max verstappen cost sergio perez  nd     pride   team player "
"303","  max   sergio   defend   lion  perez   max  drives  "
"304","max verstappen cost sergio perez  week"
"305","breaking news max verstappen  won todays sebastian vettels    race   overtakes "
"306","lap max verstappen wins  abu dhabi grand prix  th   season charles leclerc finishes   th "
"307","ferraris charles leclerc beats redbullracings sergio perez       drivers standings  "
"308","charles leclerc   masterclass  stop drive  clinch    race   drivers standings ahead  serg "
"309","  feel  sergio perez    help max verstappen win    title   max   "
"310","breaking  charles leclerc holds  sergio perez  deny red bull  onetwo   dnf  lewis hamilton giv "
"311","max verstappen wins  abu dhabi gp  charles leclerc holds onto      race   champions "
"312","max verstappen wins  abu dhabi gp ahead  charles leclerc sergio perez sainz russell norris ocon str "
"313"," max verstappen wins  abu dhabi gp  charles leclerc crosses  line    claims    champ "
"314","max verstappen wins  abudhabigp  charles leclerc     race     championship beating ser "
"315"," max verstappen yine zirvede  charles leclerc  sergio perez abudhabigp "
"316"," sun sets   marina     formula season  story  comeback domination grit amp talent "
"317","abudhabigpde zafer max verstappenin  charles leclerc  sergio perez "
"318","max verstappen wins  abu dhabi grand prix charles leclerc holds   nd sergio perez rd abudhabigp"
"319"," max verstappen signs    titlewinning campaign   recordextending th victory "
"320","  max verstappen    sergio perez past  brazil charles leclerc        "
"321","sergio perez   leclerc laps   abudhabigp"
"322","sergio perez   "
"323","max verstappen  poised  win  abu dhabi      championship    grabs    ser "
"324","sergio perez     sanyo beg  "
"325"," lap charles leclerc vs sergio perez oke cmon scuderia "
"326","rbr sergio perez radio max cant  leclerc drs     easier  leclerc  defend   "
"327","remember  fucking held hamilton      fucking teammate sergio perez"
"328","sergio perez   god beg   abeg"
"329","sergio perez checo    "
"330","  laps  latifi goes   wall   sergio perez  pass charles leclerc  fabudhabi"
"331","sergio perez please   guy please"
"332","lewis hamilton blocking sergio perez  abu dhabi  preventing  getting    wdc colourized "
"333"," scenario     red bull    sergio perez    fight       thei "
"334","sergio perez  faster move  moveeee "
"335","cmon sergio perez   catch charles leclerc formula"
"336","sergio perez  lewis hamilton battling   abudhabigp  "
"337"," laps     separate charles leclerc  sergio perez  comes   top abudhabigp leclerc perez"
"338","sergio perez   playing     position   aseasonoftheunexpected"
"339","lewis  sergio perez   hasnt forgotten  happened   "
"340","lots  stake      constructors standings  sergio perez  charles leclerc adudhabigp "
"341"," red bull  max verstappen  slow    slow charles leclerc    sergio perez  catchup "
"342"," charles leclerc vs sergio perez battle       laps abudhabigp"
"343","watching   hopefully sergio perez    winn amp finish nd   season"
"344"," laps   sergio perez  gain  claim nd  leclerc fresher tyres    abudhabigp"
"345","sergio perez     "
"346"," sergio perez versus lewis hamilton scrap     produce fun  clean racing unlike   "
"347","lap sergio perez  past lewis    straight abudhabigp"
"348"," abudhabigp  perez drs  hamilton    contact perez stays  cuz   straight line  "
"349","sergio perez   pnice formula"
"350"," laps     catch  sergio perez     catch  car    altogether "
"351","sergio perez  yourself "
"352"," hamiltons eventful  lap  abu dhabi  "
"353","sergio perez   overtake     outraced  lewis grabbing  nd drs  maintaining  abudhabigp"
"354"," verstappin demand perez  replaced  controversy continues  "
"355","lap sergio perez passes lewis hamilton  locks   loses    abudhabigp"
"356","cmon sergio perez  charging forward formula"
"357"," sergio perezs time"
"358","live  news hamiltons eventful  lap  abu dhabi "
"359","  fireworks  sergio perez  charles leclerc ferrari   lot  indecision    stop "
"360","  battle     race     championship  hotting  sergio perez  stopped  "
"361","  pace     catch leclerc sergio perez hes told     pace    abudhabigp"
"362","scuderiaferrari carlossainz    left   block sergio perez whos  strategist  ferrari "
"363","rbr tell sergio perez    expecting charles leclerc        current tyres  "
"364","sergio perez pits    told charles leclerc      time  checo  attack   looks  "
"365","lap sergio perez told  chase charles leclerc ontrack       pass cars abudhabigp"
"366","rbr tell sergio perez   laptime  spot   abudhabigp"
"367"," charles leclerc   win   finish ahead  sergio perez      onestop red bull   che "
"368","hannah cooked sergio perez strategy  nicely "
"369","sergio perez     stint abudhabigp"
"370","sergio perez     screwed    own teammate isnt  abudhabigp"
"371","sergio prez pit stop  lap   earlier  hope  doesnt lose  tires     race fighting wit "
"372","fernando alonso forced  retire  car  dnf  lap suspected water leak halfway current positions "
"373","lap sergio perez stops    time   set  hard tyres abudhabigp"
"374","  pitstop  sergio perez adudhabigp "
"375"," sergio perez told   leave red bull  max verstappen feud isnt dropped "
"376","charles leclerc  getting closer  sergio perez   adudhabigp "
"377","sergio im  held   max perez   verstappen "
"378","chrismedlandf sergio perez  finished"
"379","   max verstappen      win  sergio perez   lols abudhabigp"
"380"," top  drivers  history max verstappen  charles leclerc  juri vips  michael schumacher "
"381","  didnt materialise charles leclerc    ahead  carlos sainz    bit  sergio pere "
"382","sergio perez   wonderful team mate  player"
"383","sergio perez races "
"384","sebastian vettel    excellent job  holding  sergio perez    inadvertent helping hand  cha "
"385","sergio perez goes  hard tires adudhabigp "
"386","lap esteban ocon  yuki tsunoda  pierre gasly pit  hard tyres drivers begin    strategies "
"387","abudhabigp  george russell  sergio perez pit lewis hamilton running "
"388","sergio perez  pitted  hards  abudhabigp"
"389","sergio perezs pace  dropped   lost    ver    lap lec    tenths quicker   "
"390","  sergio perez cooking"
"391","formula teams crossword tshirt    limited time grab   abudhabigp max "
"392"," bbcf bide  time sergio perez  gazump mad max     laps        brazil "
"393","  looks ideal  red bull racinghonda   moment max verstappen leads  teammate sergio perez  "
"394","max  help sergio perez     seen    lmao theyre delusional"
"395","max  help sergio perez    "
"396","sergio perez radio   management   stage  copy  abudhabigp"
"397","david crofts commentary   start   races  unbearable charles leclerc  attacking sergio perez  se "
"398","    max verstappen doesnt    sergio perez win  race       hu "
"399","lap max verstappen starts  pole position alongside red bull team mate sergio perez max beats sergio    "
"400","  drama  redbull  brazil  sergioperez rethinking   future "
"401","abu dhabi grand prix live max verstappen targets win  pole  lewis hamilton starting fifth  sergio  "
"402","sergio perez   day"
"403","results brazil  sergio perez red bull esteban ocon alpine valtteri bottas alfa romeo lance strol "
"404"," todays formula race   max verstappen sebastain vettle sergio perez charles leclerc mick schumache "
"405","abu dhabi grand prix bet boosts sergio perez  win outright   lewis hamilton fastest "
"406","hugoraphy sebastian vettel   time sergio perez   "
"407","skysportsf max verstappen sergio perez lewis hamilton"
"408","breaking charles leclerc   didnt   sleep  night      sergio perez kept knoc "
"409","scritchy paulmv fastestpitstop     racing  am  taking  races  perez  reacting  "
"410","   drivers     grabs    history  sergio perez  red bull heres  charles lec "
"411","williamhill yourodds lewis hamilton  win abu dhabi  grand prix sergio perez nd  sebastian vettel rd"
"412","   final time  season      charles leclerc  sergio prez   yas marina circuit abu  "
"413","red bull racing  mens sergio checo perez hooded sweatshirt yipfelp  "
"414"," george russell wins  abu dhabi gp   fastest lap  charles leclerc  sergio perez  collidin "
"415"," charles    look  pass perez    abudhabigp   secure     drivers standin "
"416","nicholaslatifi youre   crashing  abu dhabi crash  sergio perez  time"
"417","maxverstappen   sergio perez    ruined  pole  monaco"
"418"," battle    sergio perez  charles leclerc   mere footnote   sebastian vettel farewel "
"419","sergio perez topps chrome ad sportscards "
"420","story  qualifying amp starting grid  abudhabigp fvault  "
"421","sergio perez told   leave red bull  max verstappen feud isntdropped "
"422"," abu dhabi gp  race winner sergio perez odds mrgreends   hope max   promise"
"423","sergio perez   fuck   hotel sectionlast corner "
"424","  sergio perez doesnt      leave  team  coulthard  david coultha "
"425","drivers parade   mexican invasion   stewards   allow  sergio perez fans    flag   "
"426","max verstappen   pole   abu dhabi gp  teammate sergio perez nd  charles leclerc rd lewis hamilt "
"427","verstappen perezs fathers weigh  saga  gmm max verstappen  sergio perezs respe "
"428","max verstappen  pole ahead  sergio perez  red bull dispute "
"429","paddypower askpaddypower     price   abu dhabi grand prix please sergio perez race winner "
"430"," ricciardo  replacing perez  red bull   horner  gmm christian horner   "
"431","christian horner  joined fellow top red bull official dr helmut marko  ruling  daniel ricciardo taking  "
"432"," win  abu dhabi grand prix max verstappen sergio perez lewis hamilton charles leclerc "
"433","eucalyptusenema ryaaaanismyname maxverstappen read little wanker     "
"434","  iwasa  sergio perez   car "
"435","sergio perez deletes tweet taunting fia  cashgate scandal grandprix gptoday formula  fnews motorsport "
"436","method max verstappen sergio perez smile  entrance row lockout  abu dhabi grandprix "
"437","    stay ahead   max verstappen  ready  play  team game  sergio perez ahead    "
"438","sergio perezs father  checo wins  truly difficult races verstappen  sergioperez maxverstappen "
"439","      drivers standings   abudhabigp  "
"440","    play   moment        time carlos sainz      probl "
"441","help  max verstappen sergio prez      accelerate      excitingbattle "
"442","abu dhabi grand prix analysis  sergio perez  charles leclercs qualifying laps "
"443","formula round abu dhabi gp qualifying max verstappen sergio perez charles leclerc th pole  max ve "
"444","sergio perez helped max verstappen win  world title    defending   lion   abu dhabi gpvers"
"445","ahead   abu dhabi gp  interviewed schecoperez  maxverstappen   ambitions   weekend  "
"446","williamhill yourodds sergio perez race winner  fav lando norris winner   "
"447","darcyx jackomarto    max verstappen  win  abu dhabi grand prix charles leclerc  finish ahead  "
"448","wizza curielaltanera daveoswald maxverstappen redbullracing    own choice checo    "
"449"," gp de abu dhabi quali  yas marina circuit pole max verstappen red bull   sergio perez red  "
"450","      maxverstappen  pass sergio perez   abudhabigp   course   fast enou "
"451","helmut marko declares  restored  max verstappen  sergio perez fiasco "
"452","redbullracing hola     season sergio prez    times        "
"453"," abudhabigp official play  sergio perez  max verstappen  verstappen   championship wrapp "
"454","leclerc delivers vow  perez pursuit "
"455","red bulls max verstappen  sergio perez lock  front row  grid  via mailsport"
"456","sergio perezs father  max verstappen   maxverstappen sergioperez "
"457","maxverstappen   favourite  win  final race   season    help  fellow red bull dri "
"458","abu dhabi grand prix max verstappen beats sergio perez  pole position  formula "
"459","max verstappen  word  adviseease    throttle   lights   tomorrow  sergio prez grab  "
"460","max verstappen seized  final pole position      blistering lap  qualifying   seasonending "
"461","max verstappen  start  pole position   final race   season   dominated  beating red  "
"462","abu dhabi grand prix max verstappen beats sergio perez  pole position bbc "
"463","abu dhabi grand prix fia  shy  investigating sergio perez monaco crash  formula "
"464","checo wins races  max  sergio perezs father      red bull drivers equation  teamm "
"465","max verstappen  sergio perez lock   front row   abu dhabi grand prix grid  redbull "
"466","abu dhabi grand prix max verstappen beats sergio perez  pole position bbc "
"467","togekirst premystic rbr proving   sportsman   team  sergio perez  christian horner encourag "
"468","consistent max verstappen    ignore red bull   snub sergioperez "
"469","  duo      drive  sergio perez  daniel ricciardo  feel theyd   synergy"
"470","dwmame lukeelvy       idea pat perez   guy players respect   sergio phil  "
"471","lukeelvy   rahm      realistic sergio  club throwing cup spitting bunker thrasher   "
"472","abu dhabi grand prix max verstappen beats sergio perez  poleposition "
"473","roblmyers    team  sergio perez     max verstappen     exact opposite   "
"474","sergio perez told    grateful  max verstappen  red bull  davidcoulthard "
"475","max  cant       cry   media  abuse refusing  acknowledge hes  poor winner "
"476","    picture   azuki nft   max verstappen  sergio perezs redbulls   abudhabigp ta "
"477","thaylock whacks max verstappen  refusing     position  red bull teammate sergio perez  sao paulo "
"478","mirror consistent max verstappen    ignore red bull   snub sergio perez  davidcoulthard "
"479"," ferrari speed  corners   faster  red bull   acceleration  getting    corners "
"480","sergioperez praises teammate maxverstappen   job  qualifying  redbull seal onetwo  "
"481"," trash   "
"482","live  news max verstappen  sergio perez lock   front row   abu dhabi grand prix grid  red bull "
"483","top  ethiadairways abudhabigp  qualifying   max verstappen  red bull racing  sergio prez "
"484","sergio perez     miami grand prix   power unit issue"
"485","live  news max verstappen  sergio perez lock   front row   abu dhabi grand prix grid  red bull "
"486","max verstappen    teammate  red bull star tipped  push  replacement  sport  "
"487","charles leclerc      sergio perez overtake opportunityarises "
"488","max verstappen  sergio perez lock   front row   abu dhabi grand prix grid  redbull "
"489","max verstappen  sergio perez lock   front row   abu dhabi grand prix grid  redbull "
"490","daily mail max verstappen  sergio perez lock   front row   abu dhabi grand prix grid  red bull "
"491","max verstappen  sergio perez occupy  front row   abu dhabi grand prix grid  redbull "
"492","   season       credit  sergio perez       reasons  maxs suc "
"493","sergio perez thank  max   tow haha    tow maxverstappen badteammate "
"494","goldengatefields race carrera winner miso fast jockey kevin radke trainer sergio  perez "
"495"," abu dhabi gp postqualifying press conference  drivers  max verstappen red bull  "
"496","wolff hopes  saturdays sacrifice  pay   sunday     strong car  protects  tires "
"497","usually  ferrari   fastest  qualifying  season pole positions   direct comparison  red "
"498","amus red bull    front row ferrari closed  scuderia    qualifying   abu dhabi gp "
"499","consistent max verstappen    ignore red bull   snub sergio perez  uk  news"
"500","charles leclerc aims  try  finish ahead  sergio perez carlos sainz  close  season     "
"501","     third free practice sessions   easy  predict  red bull  "
"502","max verstappen    teammate  red bull replacement tipped "
"503","todays postqualifying press conference  max verstappen sergio perez  charles leclerc  abudhabigp "
"504","  goes  "
"505","abu dhabi gp george russell left fuming  sergio perez incident "
"506","  sunday mirror hat      pleasure   lengthy  enlightening chat  former  racer david  "
"507","helmut marko declares  restored  max verstappen  sergio perez fiasco "
"508","abu dhabi gp sergio perez praises max verstappen   job  qualifying  red bull sealonetwo "
"509","jamesoberiko aldas top five  max verstappen charles leclerc lando norris lewis hamilton  "
"510","fastpitstop    harbours grudges  sergio perez "
"511","sergio perezs dad makes ridiculous claim  max verstappen  abu dhabi "
"512","redbull racings principal christianhorner  confirmed  former red bull driver danielricciardo   "
"513","formula  governing body  fia  prepared  investigate  sergio perez deliberately crashed  mona "
"514","youlikemypace mattxiv sergio perez washed max owned "
"515","maxverstappen locked   final pole position    season  afternoon   start alongside tea "
"516","      abudhabigp  max verstappen  sergio perez scored red bulls  front "
"517"," drift  sergio perez   nice   "
"518","charles leclerc  ferrari   options   carloz sainz onto alternate strategies     pressur "
"519","helmut marko declares  restored  max verstappen  sergio perez fiasco  uk  news"
"520","abu dhabi gp sergio perez praises max verstappen   job  qualifying  red bull sealonetwo "
"521","  stark turnaround   drama    interlagos sergio perez  rbrs teamwork   helped  nab "
"522","sergio checo prez  start   ahead  charles leclerc    race     abudhabi "
"523","abu dhabi gp sergio perez praises max verstappen   job  qualifying  red bull sealonetwo "
"524","despite missing   pole position   teammate sergio perez  pleased  red bulls performance  quali "
"525","christian horner  max verstappen  sergio prez secure red bulls  front row lockout   qualif "
"526","abu dhabi gp sergio perez praises max verstappen   job  qualifying  red bull sealonetwo "
"527","max verstappen takes pole  abu dhabi grand prix sergio perez secures qualifying lockout  red bull "
"528","perez praises verstappen   job horner brazil glitch wont sour season "
"529","live  news perez praises verstappen   job horner brazil glitch wont sour season "
"530","abu dhabi gp sergio perez praises max verstappen   job  qualifying  red bull sealonetwo "
"531","abu dhabi grand prix max verstappen beats sergio perez  pole position "
"532","maxverstappen makes  look  easy   takes  th pole   season  sergio perez completing  red bu "
"533","abu dhabi grand prix max verstappen beats sergio perez  pole position  formula formulaone abudhabi "
"534","fpsports abudhabigrandprix qualifying round  max verstappen  sergio perez  charles lecrec  carlos sai "
"535","yas marina el escenario para la final de la  en abu dabi donde el piloto de red bull max verstappen  se qued "
"536"," perez praises verstappen   job horner brazil glitch wont sour season "
"537","sergio perez signs  williams   "
"538","abu dhabi grand prix max verstappen beats sergio perez  pole position  "
"539","   battle    decided   abudhabigp "
"540","sergio perez  rumored  join prmathiasen motorsports  lmp   le mans  "
"541","   wallpapers  max verstappen sergio prez amp charles leclerc   abudhabigp qualifying sessions  "
"542"," abu dhabi gp sergio perez       team  strongly   final run "
"543","hustlepediayt djcdkrall azukiofficial bybitofficial yooooo  amazing    sergio perez fan fits "
"544","max verstappen lead  red bull onetwo   twotenths faster  teammate sergio perez   pole lecle "
"545","abu dhabi grand prix max verstappen beats sergio perez  pole position  "
"546"," round  italian grand prix   max verstappen  red bull racing  round  singapore grand prix   "
"547"," round  spanish grand prix   max verstappen  red bull racing  round  monaco grand prix   ser "
"548","  drivers  constructors standings entering  abudhabigp    max verstappen  charl "
"549"," time   race begin  sunday max verstappen outpaced sergio perez   pole   sundays seas "
"550","max verstappen helped sergio perez beat  rival     drivers championship charles leclerc  "
"551","sergio perez       position  finish   job    result tomorrow    "
"552","im convinced checo   allowed  overtake max verstappen  max    ferraris    ensur "
"553","abu dhabi grand prix max verstappen beats sergio perez  pole position  "
"554","  forwardrewind  sergio perezs onboard camera footage   max verstappen    aheadthat  "
"555","abu dhabi grand prix max verstappen beats sergio perez  pole position "
"556"," theres  opportunity ill    charles leclerc  eyeing   pass    rival sergio perez "
"557","abu dhabi grand prix max verstappen beats sergio perez  pole position  "
"558","bollisler babytthlfa danncfc haasfteam schumachermick   saying mick   useless driver   fans "
"559","     doubt  sergio perez crashed  purpose  monaco   watch  analysis  profession "
"560"," verstappen  pole  abu dhabi  prez takes  ahead  leclerc max verstappen scored  seventh pole pos "
"561","ultimate grid positions  spite   driver penalties max verstappen outpaced teammate sergio perez  "
"562","abudhabigp qualifying pole position  max verstappen   sergio prez abudhabi   "
"563","  ruth world champion max verstappen edged red bull teammate sergio perez  qualify fastest  tomorr "
"564","sergio perez   perfect  teammate    lap slower  brings sponsorship  naive   follow team "
"565","sergio perez    max verstappen    blessed    able  race    circuit  max"
"566","skysportsf sergio perezs father   max verstappen  feeling  pressure  red bull arguing  checo    teammate"
"567","abu dhabi grand prix max verstappen beats sergio perez  pole position "
"568"," addition  pole positions charles leclerc max verstappen carlos sainz sergio perez  "
"569","thereisnoif sergio perezs father   max verstappen  feeling  pressure  red bull arguing  checo    teammate"
"570"," perez praises verstappen max    job    "
"571","abu dhabi gp qualifying max verstappen beats sergio perez  final  pole  mercedes fallback "
"572","         team  red bull planned  max verstappen  tow teammate sergio  "
"573","    im  sergio perez   officei am  willing    team player  matter "
"574","andy vermaut sharesabu dhabi grand prix max verstappen beats sergio perez  pole position max verstappen leads "
"575","   drivers     team     peace   abudhabigp "
"576"," red bull driver max verstappen takes pole position  abudhabigp   max verstappen  sergio perez  charles "
"577","uk followers    video   skysportsf "
"578"," stage  set max verstappen sergio perez charles leclerc  formula abudhabigp seasonfinale "
"579","       hopefully     charles leclerc sends  warcry  fight  nd  "
"580","elizabe amcboys stanreport formularacers  deliberately read    requested fia  ruling "
"581","double world champion max verstappen claimed pole position   abudhabigp ahead  red bull teammate sergio pe "
"582","max verstappen  pole  crimson bull lockout abu dhabi entrance row max verstappen outpaced teammate sergio pe "
"583","max verstappen  red bull  hit   online threats  abuse leveled   world champion   family  "
"584","max verstappen earns chance  help sergio perez  abu dhabi grand prix pole position  teammates father call "
"585","abu dhabi gp qualifying max verstappen beats sergio perez  final  pole  mercedes fallback "
"586","max verstappen earns chance  help sergio perez  abu dhabi pole   told  cant win truly difficult "
"587","max verstappen survived  bit   scare  qualifying  emerge  pole position  tomorrows "
"588","live  news max verstappen earns chance  help sergio perez  abu dhabi grand prix pole position  teamma "
"589","daniel ricciardo    chance  replacing sergio perez  red bull "
"590","talksports max verstappen earns chance  help sergio perez  abu dhabi grand prix pole position  teammates "
"591","abu dhabi gp qualifying max verstappen beats sergio perez  final  pole  mercedes fallback "
"592","abu dhabi gp qualifying max verstappen beats sergio perez  final  pole  mercedes fallback "
"593","max verstappen  pole  red bull lockout abu dhabi front row  max verstappen outpaced tea "
"594","abu dhabi grand prix max verstappen beats sergio perez  pole position  "
"595","max verstappen earns chance  help sergio perez  abu dhabi grand prix pole position  teammates father call "
"596","max verstappen leads teammate sergio perez   red bull onetwo  qualifying   final race   season  "
"597","sergio perez   reaction  qualifying  abudhabigp sergioperez redbullracing maxverstappen  "
"598","abu dhabi grand prix max verstappen beats sergio perez  pole position  "
"599","aperta sergio perez   nico rosberg "
"600","red bull    united front  sergio perezs quest      frontrow lockout  abudhabigp qu "
"601","sergio perez  max verstappen post qualifying interview max    win  race  course    "
"602","seventh pole position  champion max verstappen     eyes    sergio perez   charles  "
"603","champion max verstappen  pole position   formula  season closer abu dhabi grand prix ahead  red bull "
