"","text"
"604","abu dhabi grand prix max verstappen beats sergio perez  pole position "
"605","    bit  confident   tomorrow  sergio perez        "
"606"," verstappen grabs pole  abu dhabi grand prix qualifying perez  "
"607","buranyibalazs   wasnt   cancelled hamiltons qualifying lap   exact  violation earlier th "
"608","abu dhabi gp qualifying max verstappen beats sergio perez  final  pole  mercedes fall  "
"609"," charles leclerc  left ruing mistakes    abudhabigp qualifying    pipped   title rival ser "
"610","verstappen beats perez  final  pole  mercedes fall  "
"611","redbullracing maxverstappen schecoperez    maxverstappen  repay    debt  perez  "
"612","live  news verstappen beats perez  final  pole  mercedes fall  "
"613"," dutchman  pole   final race   season ahead  teammate sergio perez   wasnt   smoot "
"614","charles leclerc  tomorrows race start     opportunity  sergio perez     metres "
"615"," world champion max verstappen  pole   seasonclosing abudhabigp ahead  sergio perez   red bu "
"616","abu dhabi gp qualifying max verstappen beats sergio perez  final  pole  mercedes fallback "
"617","max verstappen  pole position abu dhabi grand prix  sergio perez start nd  charles leclerc st "
"618"," sergio perez  praised  teamwork    max verstappen  qualifying   abudhabigp   "
"619","  comes sebastian vettel  lap   overtake   german  overtakes sergio perez   "
"620"," verstappen beats perez  final  pole  mercedes fall   "
"621","live  news abu dhabi grand prix max verstappen beats sergio perez  pole position "
"622","sergio checo perez   humble driver   grid      goat "
"623","max  unjustifiably portrayed   boogeyman jos verstappen speaks   brazil gps max verstappen vs  "
"624","kingjo sergio perez  lewis hamilton top tier"
"625","breaking  fia  revoked sergio perez super licence"
"626","redbullracing maxverstappen schecoperez sergio perez  max    job       "
"627","redbullracing maxverstappen schecoperez sergio  max      start   leclerc overtakes perez max   help "
"628"," verstappen beats perez  final  pole  mercedes fall   "
"629","abu dhabi gp qualifying max verstappen beats sergio perez  claim final pole    mercedes fallback "
"630","max verstappen takes abudhabigp pole  sergio perez ahead  charles leclerc sebastian vettel makes     "
"631","sergio perez  charles leclerc comparing   drivers fighting     drivers championship  "
"632","mivascha rcdigi erikvharen daniel ricciardo  set  return  red bull   teams third driver    "
"633","formula  max verstappen pole  sergio perez nd start  grand prix   front row    "
"634","abu dhabi grand prix max verstappen beats sergio perez  pole position   verstappen"
"635"," verstappen beats perez  final  pole  mercedes fall   "
"636","max verstappen  pole   seasonclosing abu dhabi grand prix ahead  sergio perez   red bull front row "
"637","pretty    doesnt  people attaching  family   own familys immediate response  cri "
"638","max verstappen claimed  final  pole position   season  helped  red bull teammate sergio pere "
"639","qualifying report red bull team mates max verstappen  sergio perez successfully locked   front row   "
"640","verstappen family  straight eurotrash max verstappens mom accuses sergio perez  cheating   wife  "
"641","st abudhabigp front row  sergio perez "
"642","max verstappen   st driver  formula history  straight poles  abu dhabi  teammate sergio pr "
"643","max verstappen  sergio perez    love   red bull lock  abudhabigp  "
"644","   maxverstappen  repay    debt  perez    perez pass    lights   "
"645","joelcfc   likeable     sergio perez"
"646","world champion max verstappen  pole    sergio perez pipped ferraris charles leclerc   "
"647","abu dhabi gp sergio perez fastest  practice   lewis hamilton avoids penalty  red flagincident "
"648","max verstappen edged red bull teammate sergio perez  pole position   final qualifying    season "
"649"," verstappen wins pole  abu dhabi gp  world champion max verstappen   lap   "
"650","bum ass barricheco aka sergio perez couldnt  qualify ahead  max  tow "
"651","max verstappen takes  th pole   season  abu dhabi   teammate sergio perez  start  ma "
"652"," max verstappen sergio perez charles leclerq succes morgen heren "
"653","sergio perez    starting position   didnt   final step    run wasnt    "
"654","max verstappen secured  th pole position    ahead  red bull teammate sergio perez amp ferraris charle "
"655","sergio perez  slow   tow abudhabigp redbullracing  ferrari  verrryyy quick  leclerc ferrari essere"
"656"," david coulthard fella ate   sergio perez pronounciation  job white "
"657","abu dhabi grand prix max verstappen beats sergio perez  pole position   ferraris  mercedes twobytwo "
"658"," hope sergio perez   world champion   "
"659"," sergio perez  charles leclerc battle     championship  comes     stages  th "
"660","qualifying pole position    max verstappen  sergio perez abudhabigp maxverstappen sergioperez "
"661","max verstappen takes  final pole position   season  beats teammate sergio perez     batt "
"662","verstappen sergio perez leclerc sainz hamilton russell norris ocon vettel ricardo "
"663","max verstappen takes abudhabigp pole  sergio perez ahead  charles leclerc sebastian vettel makes     "
"664"," pole  world champion max verstappen  abu dhabi  seventh   season  teammate sergio perez takes "
"665","max verstappen  start  abudhabigp  pole ahead  teammate sergio perez  ferraris charles leclerc le "
"666","breaking max verstappen takes pole position   abu dhabi grand prix ahead  teammate sergio perez  ferrar "
"667","kevin magnussen   season   poles  lewis hamilton  amount  poles   mercedes team  "
"668","max verstappen  sergio perez    cursed   eternity    onwards regarding racing  ab "
"669","pole  max verstappen  max verstappen  secured pole position   abu dhabi grand prix leading  red bul "
"670","  red bull front row    season finale  abu dhabi  max verstappen   pole   debate  "
"671"," result  qualifying   yas marina   max verstappen  sergio perez  charles leclerc  "
"672","  honestly  sergio perez     pole position  nd    hopefully     elbows "
"673","max verstappen   superb qualifying performance   laps   pole sergio perez  ahead  cha "
"674","max verstappen takes pole   abudhabigp   front row lockout  rbr  sergio perez  start   se "
"675"," red bull  running  tomorrow     verstappen  perez  win   compensate   "
"676","qualifying abudhabigp max verstappen sergio perez  front row start  singapore charles lecl "
"677"," pole position  verstappen  dutch driver  start  season finale  pole   teammate sergi "
"678","formula abu dhabi starting grid max verstappen oracle red bull racing sergio perez oracle red bull racing charles leclerc scuder"
"679","fin de la clasificacin  max verstappen sergio prez  charles leclerc  carlos sainz  lewis hamilt "
"680"," tow    max verstappen  beats teammate sergio perez  pole  seventh pole position   "
"681","abu dhabi grand prix qualifying results  max verstappen red bull pole  sergio perez red bull "
"682"," formula de sezonun son pole pozisyonu saniye farkla verstappenin  max verstappen  sergio perez  ch "
"683","max verstappen  sergio perez lock  front row   season finale  red bull racinghonda    "
"684","max verstappen takes   pole     sergio perez  charles leclerc carlos sainz  "
"685"," top  qualifying   yas marina   max verstappen   sergio perez   charle "
"686","     red bull max verstappen    pole sergio perez starts   charles leclerc takes "
"687","abudhabigp qualifying results max verstappen sergio perez charles leclerc carlos sainz lewis hamilt "
"688","max verstappen   pole  tomorrows abudhabigp  sergio perez  charles leclerc  carlos sainz fourth "
"689","breaking news max verstappen   pole position  tomorrows abudhabigp sergio perez  start nd   "
"690","     max verstappen  sergio perez  charles leclerc  abudhabigp"
"691","formula de sezonunun son pole pozisyonu max verstappenin oldu abudhabigp  max verstappen  sergio pe "
"692","max verstappen pole position sergio perez  red bull front row  abudhabi"
"693"," sezonun son pole pozisyonu max verstappenin  max verstappen  sergio perez  charles leclerc   "
"694","  pole  max verstappen  abu dhabi sergio perez makes   allred bull front row  charles lecle "
"695","max verstappen takes pole position   abudhabigp  sergio perez nd front row lockout  red bull "
"696","bascanvas thereisnoif schecoperez    refresher detailing   times checo  helped andor   "
"697","formula abu dhabi nd qualifying sergio perez oracle red bull racing red bull rb kmh"
"698","ite qde elenen isimler fernando alonso yuki tsunoda mick schumacher lance stroll guanyu "
"699","sergio perez st  sebastian vettel th continue  impress  rare  appearance  daniel ricciardo thr "
"700"," fin de la  avec le meilleur temps pour sergio perez  redbull  les limins  alonso alpine  "
"701","fernando alonso drops   qualifying   sergio perez leads charles leclerc   head   topten shoo "
"702","abudhabigp  sonular  sergio perez  charles leclerc  carlos sainz elenenler  fernando alonso   "
"703","ite qde elenen isimler fernando alonso yuki tsunoda mick schumacher lance stroll guanyu "
"704","redbullracing am  supposed   stupid im  max fan    earth   talking  max    "
"705","sergio perez     "
"706","sergio perez   pole position    time     dream"
"707","sergio perez  feel  bit annoyed        lap  ridiculous miles ahead   else "
"708","  max verstappen sergio perez carlos sainz charles leclerc lando norris sebastian vettel geor "
"709","abudhabigp  sonular  max verstappen  sergio perez  carlos sainz elenenler  kevin magnussen  pi "
"710","red bull boss christian horner  spiky sky sports interview  max verstappen query "
"711","sergio perezs alleged diss track  max unearthed  abudhabigp "
"712","  checo    officially renamed teammate sergio perez skyf abudhabigp"
"713","sergio perez  comes   top    charles leclerc    norris   gone thir "
"714","sergio perez races "
"715","abu dhabi gp sergio perez fastest  practice   lewis hamilton avoids penalty  red flag incident   "
"716","misscarriew    refused   wasnt   position  help sergio  didnt   chance     "
"717"," final qualification   season         abu dhabi  sergio perez   fast "
"718","sergio perezs father   verstappen  feeling  pressure  checo checo wins races  max  "
"719","theres  lot  lessons learnt christian horner reflects   situation  sergio perez  max verstapp "
"720","sergio perez  red bull  top  final  practice   season "
"721","championship fight        wire    charles leclerc  sergio perez formula  "
"722","bbc news abu dhabi grand prix fia  shy  investigating sergio perez monaco crash "
"723","red bull putting lipstick   pig  hiding max verstappensergio perez troubles feels former fdriver "
"724","abudhabigp fp sonular  sergio perez  max verstappen  lewis hamilton "
"725","sergio perezs father      max verstappen   unnecessary statements checo   dad  "
"726","perezs monaco crash    topic   discussion following  brazilgp controversy  "
"727","elpredestinato  antnio perez father  perez sergio       max  "
"728","mexican sergio perez pipped red bull team mate max verstappen   fastest time  saturdays final practice sess "
"729"," sergio perez outpaced red bull teammate  world champion max verstappen  setting  fastest time  saturd "
"730"," antonio perez speaks   son sergio     anyonehe earned     max al "
"731","antonio perez father  perez  verstappen  sergio       max  feel "
"732"," christian horner dodges sergio perez question  red bull    fia probe "
"733","abu dhabi grand prix sergio perez  top  final practice session "
"734","antonio perez father  perez  verstappen sergio       max  feels "
"735","abudhabigp sergio perez  top  final practice session "
"736"," antnio perez father  perez sergio       max  feels  breat "
"737","mexican sergio perez pipped red bull team mate max verstappen   fastest time  saturdays final practice sess "
"738","perez fastest ahead  abu dhabi qualifying hamilton  investigation "
"739","abu dhabi gp sergio perez fastest  practice   lewis hamilton investigated  red flagincident "
"740","abu dhabi gp sergio perez fastest  practice   lewis hamilton investigated  red flagincident "
"741","abu dhabi gp sergio perez fastest  practice   lewis hamilton investigated  red flagincident "
"742","abu dhabi gp sergio perez fastest  practice   lewis hamilton investigated  red flagincident "
"743","red bull driver sergio perez  fastest  final practice   abu dhabi grand prix  mercedes  lewis ha "
"744","abu dhabi gp sergio perez fastest  practice   lewis hamilton investigated  red flagincident "
"745","sergio perez  fastest   final practice session   weekend     season  abu dhabi "
"746","sergioperez clocked   lap  minute         ahead  "
"747"," yearold  serve  backup  double world champion max verstappen  sergio perez  season "
"748","sergio perez  red bull  top  final  practice   season "
"749","red bull racing driver sergio perez  topped  third  final practice session  formula  abu dhabi grand "
"750","sergio perez tops fp  redbull "
"751","abu dhabi gp sergio perez fastest  practice   lewis hamilton investigated  red flagincident "
"752","gp blog fp report sergio perez leads  red bull   final practice  lewishamilton schecoperez "
"753"," perez fastest ahead  abu dhabi qualifying hamilton  investigation "
"754","reputation  earned "
"755","jos verstappen weighs   max verstappen  sergio perezs red bull falling  "
"756","jos verstappen weighs   max verstappen  sergio perezs red bull falling  "
"757"," perez fastest ahead  abu dhabi qualifying hamilton  investigation "
"758","max verstappen branded shortsighted  sky sports pundit  sergio perez call  uk  news"
"759","fia  shy  investigating sergio perez crash  reportedly angered max verstappen  uk  news"
"760","abudhabigp sergio perez leads  red bull  final practice read   gtgt   "
"761","live  news perez fastest ahead  abu dhabi qualifying hamilton  investigation "
"762"," perez fastest  abu dhabi fp red bull teammate verstappen   "
"763","weve   pr crisis    couple  weeks  toto wolff      sergio perezs monaco  "
"764","abu dhabi gp sergio perez fastest  practice   lewis hamilton investigated  red flagincident "
"765","abu dhabi gp sergio perez fastest  practice   lewis hamilton investigated  red flagincident "
"766","fp  report sergio perez led max verstappen  fp   yas marina circuit   drivers encountered  "
"767","sergio perez set  quickest time  final practice ahead  teammate max verstappen  mercedes driver lewis ham "
"768","abu dhabi gp sergio perez fastest  practice   lewis hamilton investigated  red flagincident "
"769","    pr crises    couple  weeks   team  dont    despite  "
"770"," life  dream   drive  ferrari sergio perez"
"771","conmcdonaghf   reason verstappen beats perez  race   sergio  tequila   drinks bottle "
"772","final practice session   abudhabigp  sergio perez fastest   crucial weekend   ferrari struggling "
"773","abu dhabi gp fp red bulls dominate performance  saturdays third  final practice  abu dhabi bodes  "
"774","   missed fp heres      heading   final qualifying session   season "
"775"," perez fastest ahead  abu dhabi qualifying hamilton  investigation "
"776","sergio perez ups  ante  final practice   eyes championship runnerup spot  lewis hamilton    "
"777","sergio perez topped   practice session   weekend   season followed  max verstappen     "
"778"," top   rd practice session  yas marina   sergio perez   max verstappen  "
"779","thats  wrap  practice  sergio perez posted  quickest lap time followed  max verstappen  lewis "
"780","sergio prez clocked  fastest time  practice   abudhabigp ahead  red bull teammate max verstappen  "
"781","max verstappen branded shortsighted  sky sports pundit  sergio perezcall "
"782","sergio perez leads max verstappen  fp  abudhabigp  lewis hamilton   pierre gasly causes red flag du "
"783","max verstappen   sergio prez  front    final practice red bull ready  qualifying formula "
"784","max verstappen branded shortsighted  sky sports pundit  sergio perez call  "
"785","sergio perez  topped third  final practice session  fs abudhabigp holding  teammate max verstappen "
"786","sergio perez  fastest  fp ahead  max verstappen  lewis hamilton   stewards investigation   "
"787","sergio perez led red bull  teammate max verstappen  final practice   abudhabigp  lewis hamilton fa "
"788","abu dhabi grand prix free practice results  sergio perez red bull  max verstappen red bull "
"789","sergio perez tops practice verstappen  fastest  practice  hamilton  top  practice     pole abudhabigp "
"790"," sergio perez topped  timesheets  free practice   abudhabigp  check   results   "
"791"," result    concluded fp   sergio perez  max verstappen  lewis hamilton  abudhabigp "
"792","sergio perez fastest  practice  verstappen hamilton russell norris  leclerc red bull looking  st "
"793","formula abu dhabi rd free practice sergio perez oracle red bull racing red bull rb kmh"
"794","sergio perez  pace   final practice hour lewis hamilton  investigation  "
"795","sergio perez led    teammate max verstappen   final practice session    mercedes duo  "
"796","fp report sergio perez leads  red bull   final practice "
"797","sergio perez heads  red bull   final practice session  set    soft compound tyres  "
"798"," sergio perez  fastest  practice    max verstappen amp lewis hamilton  abudhabigp "
"799"," mercedes boss toto wolff sends sergio perez investigation message  fia "
"800","thats  final  practice     sergio perez tops  time sheets  fp  yas marina    "
"801"," abu dhabide antrenman seans sona erdi  sergio perez  max verstappen   lewis hamilton  "
"802","  advantage  red bull  sergio perez  final practice lewis hamilton   visit  stewards   "
"803","sergio perez  quickest ahead  teammate max verstappen  lewis hamilton  third "
"804","abudhabigp fp sonucu  sergio perez  max verstappen  lewis hamilton "
"805"," perez leads red bull  final abu dhabi practice   temperatures  representati "
"806"," abudhabigp sergio perez tops  final practice session  "
"807","mirror fia  shy  investigating sergio perez crash  reportedly angered max verstappen  schecoperez "
"808","sergio perez  fastest   afternoons rd practice  tomorrows abudhabigp max verstappen  nd fa "
"809","live formula max verstappen   reach  fastest time sergio prez   newattempt "
"810","five minutes   maxverstappen     improving  time      half tenth   "
"811","  witnessing  beginning  sergio perezs rosberg moment holy crap abudhabigp"
"812","sergio perez    investigated   monaco crash "
"813","suddenly sergio perez   fastest car redbull   joke "
"814","abu dhabi united arab emiratestwo drivers  level   ahead   formula  season finale  abu dhabi "
"815","formula  governing body  fia  prepared  investigate  sergio perez deliberately crashed  mona "
"816","red bull putting lipstick   pig  hiding max verstappensergio perez troubles feels formerfdriver "
"817","sergio perez     fastest  sector  mediums  sector       fastest tim "
"818","bbcf bbcf sergio perez    fear  daniel riccardos presence"
"819"," fia  ruling  perez deliberate crash probe  gmm  fia   currently lookin "
"820"," max      sergio perez     ahead  leclerc "
"821","  monaco    time ago     talking  monaco  abu dhabi    train  left  "
"822","formula team bosses    late   fia  investigate sergio perezs accident    monaco "
"823"," ricciardo  replacing perez   marko  gmm dr helmut marko moved     "
"824"," abudhabigp christian horner  steps questions  sergio perezs monaco crash "
"825"," sergio prez crash  purpose  monaco  harm verstappen answer czech abudhabi redbull alonso "
"826","public announcement max verstappen   excellent driver   lewis hamilton   sebastian vettel fernando "
"827"," sergio perez  discriminated  verstappen red bull   mainstream western sport media   mexican "
"828","red bull   replace sergio perez  daniel ricciardo   future   aussie rejoins  team  yea "
"829","daniel ricciardo looks set  return  red bull      deal    officially finalised   "
"830","daniel ricciardo looks set  return  red bull   wont  replacing sergio perez  team principal chris "
"831","mohammed ben sulayem   fia     happy  investigate sergio perezs crash  monaco earlier "
"832","monaco    time ago sergio perez shies   adding  fuel  monaco gp controversy "
"833","  news        "
"834"," news danielricciardo returns  redbull  season reserve driver max verstappen sergio perez contr "
"835"," ranking projection   battle     formula      abudhabigp     outcome "
"836","max verstappen    protected  isnt    investigate amp   fault  penalise max  def "
"837","fs governing body  fia   hide  investigating  sergio perez crashed deliberately  monaco "
"838","fia  shy  investigating sergio perez monaco crash "
"839"," sergio perez rebuffs monaco grand prix query  max verstappens angry message "
"840"," red bull controversy     max verstappens mother   fired   sergio perez   stro "
"841","max verstappen words  sergio perez  breaking motor sportsnews "
"842","sergio perez rebuffs monaco grand prix query  max verstappens angrymessage "
"843","sergio perez backtracks  max verstappen criticism regrets  comments planet       "
"844","red bulls sergio perez   regrets    comments    max verstappen   formula world "
"845","red bull racing  set    formula season   nonfungible token embellished  vehicles   driver "
"846","breaking news azukiofficial   showcased  max verstappen amp sergio perez cars   chase  final vict "
"847","   timeline  sergio perez      car  ferrari   charles   title run  "
"848","youlikemypace ziadej cobratate calls   dick rider   sergio perez   dp nice  dick rider"
"849","abu dhabi grand prix fp  max verstappen  george russell  charles leclerc  "
"850","fia president makes investigation guarantee  max verstappen spat  sergio perez bensulayem    "
"851","charles leclerc  sergio perez       penultimate lap george russell overtakes max verstappe "
"852","zaryan geegrimz youlikemypace cobratate sseagalofficial        aint sergio perez  "
"853","geegrimz youlikemypace cobratate sseagalofficial   dont watch   dont  ow sergio perez casual"
"854","   distraction rb budget cap violations  rb  news fia  investigate sergio perez "
"855","red bull drivers row  max verstappen refuses team    sergio perez past  sao paulo gp sky sports "
"856","breaking sergio perez   replaced  sebastien buemi  ferrari"
"857","virtual lap sergio perez drives  rb  yas marina circuit click   photo   check     st "
"858","outlapfpodcast   weird      pressure  sergio perez  stay   pace     sce "
"859","sergio perez charles leclerc battle   sebastian vettel braces  lastrace "
"860","sergio perez     qatar grand prix   gear box issue"
"861","red bull driver sergio prez schecoperez refuted  rumors   purposefully crashed    mona "
"862","sergio perez topps chrome sportscards ad "
"863","maxverstappen  ur family     public comments  sergio perez   family    fair "
"864","natiou  chillibadger united  disliking sergio perez   teammate"
"865"," via wearetherace          verstappen   brazil   "
"866","max verstappen    teammate  red bull star tipped  push  replacement "
"867","fastestpitstop maybe hes  standby  replace sergio perez"
"868","   else   unacceptable  girlfriends father calling  driver    "
"869","max verstappen  abuse  family  unacceptable following  paulo grand prix "
"870","  hypocrite  invited  support  observe black lives matter max claimed  didnt understand  obvi "
"871","dsoracing tomcoronel tomcoronel  erikvharen       proofs   monaco mischievous sergi "
"872"," word   liam lawson  replaced   fp  world champion max verstappen        "
"873","red bulls competitiveness      flying lap   lead  max verstappen  george "
"874"," indulge   luxury  penalizing  competitiveness   car    straights  extra "
"875","despite   milton keynes team    change  fp   comparison  giving max verstappen   "
"876","kimi raikkonen  won  azerbaijan grand prix sergio perez finishes   logan sargeant takes third"
"877","pg   reminded    status  team "
"878","followed  lewis hamilton sergio perez  carlos sainz  dutchman   gap    tenths   "
"879","victory  max verstapen  weekend  barhain max verstapen valteri bottas sergio perez driver   "
"880","formula  governing body  fia  prepared  investigate  sergio perez deliberately crashed  monaco  "
"881","matthewcarter    im  sergio perez"
"882","abu dhabi grand prix fia  shy  investigating sergio perez monaco crash  "
"883","max verstappen hits   media  reaction  sergio perez team  snub  red bull defend driver "
"884","bearical startonpole ocon isnt  level  alonso  ocon  caused th   annoying jobs  ex teammates sergio perez"
"885","sergio perez  doing bare minimum      "
"886","formula  governing body  fia  prepared  investigate  sergio perez deliberately crashed  mona "
"887","lewis hamilton  sergio perez   dream duo"
"888","chris andrewbensonf     sergio perezs mexican fans amp gangsters fans threaten  rape amp kill "
"889","     shortsighted  max  "
"890","red bull  set  tone    run  medium tires     extreme    lap  sergio "
"891"," red bull    world titles   pockets    strike    final  goa "
"892","niels max verstappen     legitimate overtake  sergio perez  teammates"
"893","abu dhabi grand prix fia  shy  investigating sergio perez monaco crash  "
"894","sergio perez   car          sessions     morning  "
"895"," perez  raises questions verstappen   team  disservice  accident raises questions sergio perez "
"896","formula  governing body  fia  prepared  investigate  sergio perez deliberately crashed  monaco  "
"897","max verstappens mum fires shocking allegation  sergioperez "
